[
  {
    "base_url": "http://detroit-vod.cablecast.tv/CablecastPublicSite",
    "medias": [
      {
        "url": "http://detroit-vod.cablecast.tv/CablecastPublicSite/CablecastPublicSite/show/14093?site=1",
        "title": "Detroit City Council Formal Session pt2   11-26-2024",
        "date": "2024-11-26",
        "source_type": "video"
      },
      {
        "url": "http://detroit-vod.cablecast.tv/CablecastPublicSite/CablecastPublicSite/show/14092?site=1",
        "title": "Detroit City Council Formal Session pt1   11-26-2024",
        "date": "2024-11-26",
        "source_type": "video"
      },
      {
        "url": "http://detroit-vod.cablecast.tv/CablecastPublicSite/CablecastPublicSite/show/14091?site=1",
        "title": "Detroit City Council Public Health And  Safety  11-25-2024",
        "date": "2024-11-25",
        "source_type": "video"
      },
      {
        "url": "http://detroit-vod.cablecast.tv/CablecastPublicSite/CablecastPublicSite/show/14084?site=1",
        "title": "Detroit City Council Budget Finance Audit  _  11-20-2024",
        "date": "2024-11-20",
        "source_type": "video"
      },
      {
        "url": "http://detroit-vod.cablecast.tv/CablecastPublicSite/CablecastPublicSite/show/14083?site=1",
        "title": "Detroit City Council Planning and Economic Development pt2  11-21-2024",
        "date": "2024-11-21",
        "source_type": "video"
      },
      {
        "url": "http://detroit-vod.cablecast.tv/CablecastPublicSite/CablecastPublicSite/show/14082?site=1",
        "title": "Detroit City Council Planning and Economic Development  pt1   11-21-2024",
        "date": "2024-11-21",
        "source_type": "video"
      },
      {
        "url": "http://detroit-vod.cablecast.tv/CablecastPublicSite/CablecastPublicSite/show/14081?site=1",
        "title": "Detroit City Council Neighborhoods  11-21-2024",
        "date": "2024-11-21",
        "source_type": "video"
      },
      {
        "url": "http://detroit-vod.cablecast.tv/CablecastPublicSite/CablecastPublicSite/show/14080?site=1",
        "title": "Detroit City Council Budget Finance Audit  _ 11-20-2024",
        "date": "2024-11-20",
        "source_type": "video"
      },
      {
        "url": "http://detroit-vod.cablecast.tv/CablecastPublicSite/CablecastPublicSite/show/14078?site=1",
        "title": "Detroit City Council Internal Operations   11-20-2024",
        "date": "2024-11-20",
        "source_type": "video"
      },
      {
        "url": "http://detroit-vod.cablecast.tv/CablecastPublicSite/CablecastPublicSite/show/14077?site=1",
        "title": "Detroit City Council Formal Session   11-19-2024",
        "date": "2024-11-19",
        "source_type": "video"
      },
      {
        "url": "http://detroit-vod.cablecast.tv/CablecastPublicSite/CablecastPublicSite/show/14074?site=1",
        "title": "Detroit City Council Public Health And  Safety  11-18-2024",
        "date": "2024-11-18",
        "source_type": "video"
      },
      {
        "url": "http://detroit-vod.cablecast.tv/CablecastPublicSite/CablecastPublicSite/show/14072?site=1",
        "title": "Detroit City Council Neighborhoods  11-14-2024",
        "date": "2024-11-14",
        "source_type": "video"
      },
      {
        "url": "http://detroit-vod.cablecast.tv/CablecastPublicSite/CablecastPublicSite/show/14071?site=1",
        "title": "Detroit City Council Planning and Economic Development   11-14-2024",
        "date": "2024-11-14",
        "source_type": "video"
      },
      {
        "url": "http://detroit-vod.cablecast.tv/CablecastPublicSite/CablecastPublicSite/show/14070?site=1",
        "title": "Detroit City Council Budget Finance Audit  11-13-2024",
        "date": "2024-11-13",
        "source_type": "video"
      },
      {
        "url": "http://detroit-vod.cablecast.tv/CablecastPublicSite/CablecastPublicSite/show/14069?site=1",
        "title": "Detroit City Council Internal Operations   11-13-2024",
        "date": "2024-11-13",
        "source_type": "video"
      },
      {
        "url": "http://detroit-vod.cablecast.tv/CablecastPublicSite/CablecastPublicSite/show/14068?site=1",
        "title": "Detroit City Council Formal Session   11-12-2024",
        "date": "2024-11-12",
        "source_type": "video"
      },
      {
        "url": "http://detroit-vod.cablecast.tv/CablecastPublicSite/CablecastPublicSite/show/14076?site=1",
        "title": "Detroit City Council Evening Community Meeting At Large 11-12-2024",
        "date": "2024-11-12",
        "source_type": "video"
      },
      {
        "url": "http://detroit-vod.cablecast.tv/CablecastPublicSite/CablecastPublicSite/show/14066?site=1",
        "title": "Detroit City Council Committee of The Whole ARPA Discussion   11-07-2024",
        "date": "2024-11-07",
        "source_type": "video"
      },
      {
        "url": "http://detroit-vod.cablecast.tv/CablecastPublicSite/CablecastPublicSite/show/14065?site=1",
        "title": "Detroit City Council Neighborhoods  11-07-2024",
        "date": "2024-11-07",
        "source_type": "video"
      },
      {
        "url": "http://detroit-vod.cablecast.tv/CablecastPublicSite/CablecastPublicSite/show/14064?site=1",
        "title": "Detroit City Council Planning and Economic Development   11-07-2024",
        "date": "2024-11-07",
        "source_type": "video"
      },
      {
        "url": "http://detroit-vod.cablecast.tv/CablecastPublicSite/CablecastPublicSite/show/14063?site=1",
        "title": "Detroit City Council Budget Finance Audit  11-06-2024",
        "date": "2024-11-06",
        "source_type": "video"
      },
      {
        "url": "http://detroit-vod.cablecast.tv/CablecastPublicSite/CablecastPublicSite/show/14062?site=1",
        "title": "Detroit City Council Internal Operations   11-06-2024",
        "date": "2024-11-06",
        "source_type": "video"
      },
      {
        "url": "http://detroit-vod.cablecast.tv/CablecastPublicSite/CablecastPublicSite/show/14060?site=1",
        "title": "Detroit City Council Dangerous Buildings  11-04-2024",
        "date": "2024-11-04",
        "source_type": "video"
      },
      {
        "url": "http://detroit-vod.cablecast.tv/CablecastPublicSite/CablecastPublicSite/show/14059?site=1",
        "title": "Detroit City Council Public Health And  Safety  11-04-2024",
        "date": "2024-11-04",
        "source_type": "video"
      },
      {
        "url": "http://detroit-vod.cablecast.tv/CablecastPublicSite/CablecastPublicSite/show/14057?site=1",
        "title": "Detroit City Council Neighborhoods  10-31-2024",
        "date": "2024-10-31",
        "source_type": "video"
      },
      {
        "url": "http://detroit-vod.cablecast.tv/CablecastPublicSite/CablecastPublicSite/show/14056?site=1",
        "title": "Detroit City Council Planning and Economic Development   10-31-2024",
        "date": "2024-10-31",
        "source_type": "video"
      },
      {
        "url": "http://detroit-vod.cablecast.tv/CablecastPublicSite/CablecastPublicSite/show/14054?site=1",
        "title": "Detroit City Council Budget Finance Audit  10-30-2024",
        "date": "2024-10-30",
        "source_type": "video"
      },
      {
        "url": "http://detroit-vod.cablecast.tv/CablecastPublicSite/CablecastPublicSite/show/14053?site=1",
        "title": "Detroit City Council Internal Operations   10-30-2024",
        "date": "2024-10-30",
        "source_type": "video"
      },
      {
        "url": "http://detroit-vod.cablecast.tv/CablecastPublicSite/CablecastPublicSite/show/14051?site=1",
        "title": "Detroit City Council Formal Session   10-29-2024",
        "date": "2024-10-29",
        "source_type": "video"
      },
      {
        "url": "http://detroit-vod.cablecast.tv/CablecastPublicSite/CablecastPublicSite/show/14048?site=1",
        "title": "Detroit City Council Public Health And  Safety  10-28-2024",
        "date": "2024-10-28",
        "source_type": "video"
      },
      {
        "url": "http://detroit-vod.cablecast.tv/CablecastPublicSite/CablecastPublicSite/show/14043?site=1",
        "title": "Detroit City Council Neighborhoods  10-24-2024",
        "date": "2024-10-24",
        "source_type": "video"
      },
      {
        "url": "http://detroit-vod.cablecast.tv/CablecastPublicSite/CablecastPublicSite/show/14042?site=1",
        "title": "Detroit City Council Planning and Economic Development   10-24-2024",
        "date": "2024-10-24",
        "source_type": "video"
      },
      {
        "url": "http://detroit-vod.cablecast.tv/CablecastPublicSite/CablecastPublicSite/show/14039?site=1",
        "title": "Detroit City Council Internal Operations   10-23-2024",
        "date": "2024-10-23",
        "source_type": "video"
      },
      {
        "url": "http://detroit-vod.cablecast.tv/CablecastPublicSite/CablecastPublicSite/show/14040?site=1",
        "title": "Detroit City Council Budget Finance Audit  10-23-2024",
        "date": "2024-10-23",
        "source_type": "video"
      },
      {
        "url": "http://detroit-vod.cablecast.tv/CablecastPublicSite/CablecastPublicSite/show/14038?site=1",
        "title": "Detroit City Council Formal Session pt2  10-22-2024",
        "date": "2024-10-22",
        "source_type": "video"
      },
      {
        "url": "http://detroit-vod.cablecast.tv/CablecastPublicSite/CablecastPublicSite/show/14037?site=1",
        "title": "Detroit City Council Formal Session pt1 10-22-2024",
        "date": "2024-10-22",
        "source_type": "video"
      },
      {
        "url": "http://detroit-vod.cablecast.tv/CablecastPublicSite/CablecastPublicSite/show/14035?site=1",
        "title": "Detroit City Council Dangerous Buildings  10-21-2024",
        "date": "2024-10-21",
        "source_type": "video"
      },
      {
        "url": "http://detroit-vod.cablecast.tv/CablecastPublicSite/CablecastPublicSite/show/14034?site=1",
        "title": "Detroit City Council Public Health And  Safety  10-21-2024",
        "date": "2024-10-21",
        "source_type": "video"
      },
      {
        "url": "http://detroit-vod.cablecast.tv/CablecastPublicSite/CablecastPublicSite/show/14030?site=1",
        "title": "Detroit City Council Neighborhoods  10-17-2024",
        "date": "2024-10-17",
        "source_type": "video"
      },
      {
        "url": "http://detroit-vod.cablecast.tv/CablecastPublicSite/CablecastPublicSite/show/14029?site=1",
        "title": "Detroit City Council Planning and Economic Development   10-17-2024",
        "date": "2024-10-17",
        "source_type": "video"
      },
      {
        "url": "http://detroit-vod.cablecast.tv/CablecastPublicSite/CablecastPublicSite/show/14025?site=1",
        "title": "Detroit City Council Budget Finance Audit  10-16-2024",
        "date": "2024-10-16",
        "source_type": "video"
      },
      {
        "url": "http://detroit-vod.cablecast.tv/CablecastPublicSite/CablecastPublicSite/show/14023?site=1",
        "title": "Detroit City Council Internal Operations   10-16-2024",
        "date": "2024-10-16",
        "source_type": "video"
      },
      {
        "url": "http://detroit-vod.cablecast.tv/CablecastPublicSite/CablecastPublicSite/show/14021?site=1",
        "title": "Detroit City Council Formal Session  10-15-2024",
        "date": "2024-10-15",
        "source_type": "video"
      },
      {
        "url": "http://detroit-vod.cablecast.tv/CablecastPublicSite/CablecastPublicSite/show/14031?site=1",
        "title": "Detroit City Council Evening Community Meeting Dist 6   10-15-2024",
        "date": "2024-10-15",
        "source_type": "video"
      },
      {
        "url": "http://detroit-vod.cablecast.tv/CablecastPublicSite/CablecastPublicSite/show/14014?site=1",
        "title": "Detroit City Council Formal Session  10-08-2024",
        "date": "2024-10-08",
        "source_type": "video"
      },
      {
        "url": "http://detroit-vod.cablecast.tv/CablecastPublicSite/CablecastPublicSite/show/14012?site=1",
        "title": "Detroit City Council Dangerous Buildings  10-07-2024",
        "date": "2024-10-07",
        "source_type": "video"
      },
      {
        "url": "http://detroit-vod.cablecast.tv/CablecastPublicSite/CablecastPublicSite/show/14011?site=1",
        "title": "Detroit City Council Public Health And  Safety  10-07-2024",
        "date": "2024-10-07",
        "source_type": "video"
      },
      {
        "url": "http://detroit-vod.cablecast.tv/CablecastPublicSite/CablecastPublicSite/show/14005?site=1",
        "title": "Detroit City Council Neighborhoods  10-03-2024",
        "date": "2024-10-03",
        "source_type": "video"
      },
      {
        "url": "http://detroit-vod.cablecast.tv/CablecastPublicSite/CablecastPublicSite/show/14004?site=1",
        "title": "Detroit City Council Planning and Economic Development   10-03-2024",
        "date": "2024-10-03",
        "source_type": "video"
      },
      {
        "url": "http://detroit-vod.cablecast.tv/CablecastPublicSite/CablecastPublicSite/show/13997?site=1",
        "title": "Detroit City Council Budget Finance Audit  10-02-2024",
        "date": "2024-10-02",
        "source_type": "video"
      },
      {
        "url": "http://detroit-vod.cablecast.tv/CablecastPublicSite/CablecastPublicSite/show/13996?site=1",
        "title": "Detroit City Council Internal Operations   10-02-2024",
        "date": "2024-10-02",
        "source_type": "video"
      },
      {
        "url": "http://detroit-vod.cablecast.tv/CablecastPublicSite/CablecastPublicSite/show/14006?site=1",
        "title": "Detroit City Council  Formal Session No Public Comm  pt1   10-01-2024--",
        "date": "2024-10-01",
        "source_type": "video"
      },
      {
        "url": "http://detroit-vod.cablecast.tv/CablecastPublicSite/CablecastPublicSite/show/14007?site=1",
        "title": "Detroit City Council Formal Session No Public Comm pt2 10-01-2024l-",
        "date": "2024-10-01",
        "source_type": "video"
      },
      {
        "url": "http://detroit-vod.cablecast.tv/CablecastPublicSite/CablecastPublicSite/show/14008?site=1",
        "title": "Detroit City Council Formal Session Public Comm  10-01-2024-",
        "date": "2024-10-01",
        "source_type": "video"
      },
      {
        "url": "http://detroit-vod.cablecast.tv/CablecastPublicSite/CablecastPublicSite/show/13991?site=1",
        "title": "Detroit City Council Public Health And Safety  09-30-2024",
        "date": "2024-09-30",
        "source_type": "video"
      },
      {
        "url": "http://detroit-vod.cablecast.tv/CablecastPublicSite/CablecastPublicSite/show/13987?site=1",
        "title": "Detroit City Council Planning and Economic Development   09-26-2024",
        "date": "2024-09-26",
        "source_type": "video"
      },
      {
        "url": "http://detroit-vod.cablecast.tv/CablecastPublicSite/CablecastPublicSite/show/13986?site=1",
        "title": "Detroit City Council REPARATIONS TASKFORCE MEETING  09-07-2024  Revised",
        "date": "2024-09-07",
        "source_type": "video"
      },
      {
        "url": "http://detroit-vod.cablecast.tv/CablecastPublicSite/CablecastPublicSite/show/13994?site=1",
        "title": "Detroit City Council Evening Community Meeting Dist5  09-26-2024",
        "date": "2024-09-26",
        "source_type": "video"
      },
      {
        "url": "http://detroit-vod.cablecast.tv/CablecastPublicSite/CablecastPublicSite/show/13985?site=1",
        "title": "Detroit City Council Budget Finance Audit 1  09-25-2024",
        "date": "2024-09-25",
        "source_type": "video"
      },
      {
        "url": "http://detroit-vod.cablecast.tv/CablecastPublicSite/CablecastPublicSite/show/13984?site=1",
        "title": "Detroit City Council Internal Operations   09-25-2024",
        "date": "2024-09-25",
        "source_type": "video"
      },
      {
        "url": "http://detroit-vod.cablecast.tv/CablecastPublicSite/CablecastPublicSite/show/13980?site=1",
        "title": "Detroit City Council Formal Session  09-24-2024",
        "date": "2024-09-24",
        "source_type": "video"
      },
      {
        "url": "http://detroit-vod.cablecast.tv/CablecastPublicSite/CablecastPublicSite/show/13979?site=1",
        "title": "Detroit City Council Dangerous Buildings  09-23-2024",
        "date": "2024-09-23",
        "source_type": "video"
      },
      {
        "url": "http://detroit-vod.cablecast.tv/CablecastPublicSite/CablecastPublicSite/show/13977?site=1",
        "title": "Detroit City Council Public Health And  Safety  09-23-2024",
        "date": "2024-09-23",
        "source_type": "video"
      },
      {
        "url": "http://detroit-vod.cablecast.tv/CablecastPublicSite/CablecastPublicSite/show/13976?site=1",
        "title": "Detroit City Council Neighborhoods  09-19-2024",
        "date": "2024-09-19",
        "source_type": "video"
      },
      {
        "url": "http://detroit-vod.cablecast.tv/CablecastPublicSite/CablecastPublicSite/show/13975?site=1",
        "title": "Detroit City Council Planning and Economic Development   09-19-2024",
        "date": "2024-09-19",
        "source_type": "video"
      },
      {
        "url": "http://detroit-vod.cablecast.tv/CablecastPublicSite/CablecastPublicSite/show/13973?site=1",
        "title": "Detroit City Council Budget Finance Audit pt2  09-18-2024",
        "date": "2024-09-18",
        "source_type": "video"
      },
      {
        "url": "http://detroit-vod.cablecast.tv/CablecastPublicSite/CablecastPublicSite/show/13972?site=1",
        "title": "Detroit City Council Budget Finance Audit pt1  09-18-2024",
        "date": "2024-09-18",
        "source_type": "video"
      },
      {
        "url": "http://detroit-vod.cablecast.tv/CablecastPublicSite/CablecastPublicSite/show/13971?site=1",
        "title": "Detroit City Council Internal Operations   09-18-2024",
        "date": "2024-09-18",
        "source_type": "video"
      },
      {
        "url": "http://detroit-vod.cablecast.tv/CablecastPublicSite/CablecastPublicSite/show/13969?site=1",
        "title": "Detroit City Council Formal Session part 2 09-17-2024",
        "date": "2024-09-17",
        "source_type": "video"
      },
      {
        "url": "http://detroit-vod.cablecast.tv/CablecastPublicSite/CablecastPublicSite/show/13968?site=1",
        "title": "Detroit City Council Formal Session part 1  09-17-2024",
        "date": "2024-09-17",
        "source_type": "video"
      },
      {
        "url": "http://detroit-vod.cablecast.tv/CablecastPublicSite/CablecastPublicSite/show/13966?site=1",
        "title": "Detroit City Council Public Health And  Safety  09-16-2024",
        "date": "2024-09-16",
        "source_type": "video"
      },
      {
        "url": "http://detroit-vod.cablecast.tv/CablecastPublicSite/CablecastPublicSite/show/13960?site=1",
        "title": "Detroit City Council Formal Session  09-10-2024",
        "date": "2024-09-10",
        "source_type": "video"
      },
      {
        "url": "http://detroit-vod.cablecast.tv/CablecastPublicSite/CablecastPublicSite/show/13956?site=1",
        "title": "Detroit City Council Public Health And  Safety  09-09-2024",
        "date": "2024-09-09",
        "source_type": "video"
      },
      {
        "url": "http://detroit-vod.cablecast.tv/CablecastPublicSite/CablecastPublicSite/show/13952?site=1",
        "title": "Detroit City Council Neighborhoods pt3   09-05-2024",
        "date": "2024-09-05",
        "source_type": "video"
      },
      {
        "url": "http://detroit-vod.cablecast.tv/CablecastPublicSite/CablecastPublicSite/show/13951?site=1",
        "title": "Detroit City Council Neighborhoods pt2  09-05-2024",
        "date": "2024-09-05",
        "source_type": "video"
      },
      {
        "url": "http://detroit-vod.cablecast.tv/CablecastPublicSite/CablecastPublicSite/show/13950?site=1",
        "title": "Detroit City Council Neighborhoods pt1  09-05-2024",
        "date": "2024-09-05",
        "source_type": "video"
      },
      {
        "url": "http://detroit-vod.cablecast.tv/CablecastPublicSite/CablecastPublicSite/show/13949?site=1",
        "title": "Detroit City Council Planning and Economic Development   09-05-2024",
        "date": "2024-09-05",
        "source_type": "video"
      },
      {
        "url": "http://detroit-vod.cablecast.tv/CablecastPublicSite/CablecastPublicSite/show/13946?site=1",
        "title": "Detroit City Council Budget Finance Audit  09-04-2024",
        "date": "2024-09-04",
        "source_type": "video"
      },
      {
        "url": "http://detroit-vod.cablecast.tv/CablecastPublicSite/CablecastPublicSite/show/13936?site=1",
        "title": "Detroit City Council Internal Operations pt2   09-04-2024",
        "date": "2024-09-04",
        "source_type": "video"
      },
      {
        "url": "http://detroit-vod.cablecast.tv/CablecastPublicSite/CablecastPublicSite/show/13935?site=1",
        "title": "Detroit City Council Internal Operations pt1   09-04-2024",
        "date": "2024-09-04",
        "source_type": "video"
      },
      {
        "url": "http://detroit-vod.cablecast.tv/CablecastPublicSite/CablecastPublicSite/show/13932?site=1",
        "title": "Detroit City Council Formal Session  09-03-2024",
        "date": "2024-09-03",
        "source_type": "video"
      },
      {
        "url": "http://detroit-vod.cablecast.tv/CablecastPublicSite/CablecastPublicSite/show/13761?site=1",
        "title": "Detroit City Council Formal Session pt2  07-30-2024",
        "date": "2024-07-30",
        "source_type": "video"
      },
      {
        "url": "http://detroit-vod.cablecast.tv/CablecastPublicSite/CablecastPublicSite/show/13760?site=1",
        "title": "Detroit City Council Formal Session pt1  07-30-2024",
        "date": "2024-07-30",
        "source_type": "video"
      },
      {
        "url": "http://detroit-vod.cablecast.tv/CablecastPublicSite/CablecastPublicSite/show/13751?site=1",
        "title": "Detroit City Council Public Health And  Safety  07-29-2024",
        "date": "2024-07-29",
        "source_type": "video"
      },
      {
        "url": "http://detroit-vod.cablecast.tv/CablecastPublicSite/CablecastPublicSite/show/13745?site=1",
        "title": "Detroit City Council Neighborhoods  07-25-2024",
        "date": "2024-07-25",
        "source_type": "video"
      },
      {
        "url": "http://detroit-vod.cablecast.tv/CablecastPublicSite/CablecastPublicSite/show/13744?site=1",
        "title": "Detroit City Council Planning and Economic Development   07-25-2024",
        "date": "2024-07-25",
        "source_type": "video"
      },
      {
        "url": "http://detroit-vod.cablecast.tv/CablecastPublicSite/CablecastPublicSite/show/13742?site=1",
        "title": "Detroit City Council Budget Finance Audit  07-24-2024",
        "date": "2024-07-24",
        "source_type": "video"
      },
      {
        "url": "http://detroit-vod.cablecast.tv/CablecastPublicSite/CablecastPublicSite/show/13741?site=1",
        "title": "Detroit City Council Internal Operations   07-24-2024",
        "date": "2024-07-24",
        "source_type": "video"
      },
      {
        "url": "http://detroit-vod.cablecast.tv/CablecastPublicSite/CablecastPublicSite/show/13743?site=1",
        "title": "Detroit City Council Committee of The Whole Discussion  07-24-2024",
        "date": "2024-07-24",
        "source_type": "video"
      },
      {
        "url": "http://detroit-vod.cablecast.tv/CablecastPublicSite/CablecastPublicSite/show/13747?site=1",
        "title": "Detroit City Council Committee of The Whole Discussion  07-24-2024",
        "date": "2024-07-24",
        "source_type": "video"
      },
      {
        "url": "http://detroit-vod.cablecast.tv/CablecastPublicSite/CablecastPublicSite/show/13739?site=1",
        "title": "Detroit City Council Formal Session   07-23-2024",
        "date": "2024-07-23",
        "source_type": "video"
      },
      {
        "url": "http://detroit-vod.cablecast.tv/CablecastPublicSite/CablecastPublicSite/show/13737?site=1",
        "title": "Detroit City Council Public Health And  Safety  07-22-2024",
        "date": "2024-07-22",
        "source_type": "video"
      }
    ]
  },
  {
    "base_url": "https://www.lansdale.org/CivicMedia?CID=2024-Council-Meetings-26",
    "medias": [
      {
        "url": "https://www.lansdale.org/CivicMedia.aspx?VID=Work-Session-1242024-262#player",
        "title": "Work Session 12.4.2024",
        "date": "2024-12-05",
        "source_type": "video"
      },
      {
        "url": "https://www.lansdale.org/CivicMedia.aspx?VID=November-20-Business-Meeting-260#player",
        "title": "November 20 Business Meeting",
        "date": "2024-11-21",
        "source_type": "video"
      },
      {
        "url": "https://www.lansdale.org/CivicMedia.aspx?VID=November-6-Work-Session-259#player",
        "title": "November 6 Work Session",
        "date": "2024-11-12",
        "source_type": "video"
      },
      {
        "url": "https://www.lansdale.org/CivicMedia.aspx?VID=101624-Business-Meeting-2-258#player",
        "title": "101624 Business Meeting 2",
        "date": "2024-10-23",
        "source_type": "video"
      },
      {
        "url": "https://www.lansdale.org/CivicMedia.aspx?VID=10022024-worksession-257#player",
        "title": "10022024 worksession",
        "date": "2024-10-07",
        "source_type": "video"
      },
      {
        "url": "https://www.lansdale.org/CivicMedia.aspx?VID=September-18-Business-Meeting-256#player",
        "title": "September 18 Business Meeting",
        "date": "2024-09-19",
        "source_type": "video"
      },
      {
        "url": "https://www.lansdale.org/CivicMedia.aspx?VID=Work-Session-September-4-255#player",
        "title": "Work Session September 4",
        "date": "2024-09-05",
        "source_type": "video"
      },
      {
        "url": "https://www.lansdale.org/CivicMedia.aspx?VID=082124BusinessMeeting-254#player",
        "title": "082124BusinessMeeting",
        "date": "2024-08-28",
        "source_type": "video"
      },
      {
        "url": "https://www.lansdale.org/CivicMedia.aspx?VID=August-7-2024-Work-Session-253#player",
        "title": "August 7, 2024 Work Session",
        "date": "2024-08-09",
        "source_type": "video"
      }
    ]
  },
  {
    "base_url": "https://www.regionalwebtv.com/fredcc",
    "medias": [
      {
        "url": "https://www-regionalwebtv-com.filesusr.com/html/2c630b_4169353b52a2aaf92a9c9e1c8f33282b.html?wchannelid=bxn9claes7&wmediaid=6tmj2130np",
        "title": "Fredericksburg City Council 12/10/2024",
        "date": "2024-12-10",
        "source_type": "video"
      },
      {
        "url": "https://www-regionalwebtv-com.filesusr.com/html/2c630b_4169353b52a2aaf92a9c9e1c8f33282b.html?wchannelid=bxn9claes7&wmediaid=glz3s4axpo",
        "title": "Fredericksburg City Council Worksession 12/10/2024",
        "date": "2024-12-10",
        "source_type": "video"
      },
      {
        "url": "https://www-regionalwebtv-com.filesusr.com/html/2c630b_4169353b52a2aaf92a9c9e1c8f33282b.html?wchannelid=bxn9claes7&wmediaid=elcioeb2ph",
        "title": "Fredericksburg City Council 11/26/2024",
        "date": "2024-11-26",
        "source_type": "video"
      },
      {
        "url": "https://www-regionalwebtv-com.filesusr.com/html/2c630b_4169353b52a2aaf92a9c9e1c8f33282b.html?wchannelid=bxn9claes7&wmediaid=5exmaqm8ps",
        "title": "Fredericksburg City Council Worksession 11/26/2024",
        "date": "2024-11-26",
        "source_type": "video"
      },
      {
        "url": "https://www-regionalwebtv-com.filesusr.com/html/2c630b_4169353b52a2aaf92a9c9e1c8f33282b.html?wchannelid=bxn9claes7&wmediaid=4c46emkgeq",
        "title": "Fredericksburg City Council 11/12/2024",
        "date": "2024-11-12",
        "source_type": "video"
      },
      {
        "url": "https://www-regionalwebtv-com.filesusr.com/html/2c630b_4169353b52a2aaf92a9c9e1c8f33282b.html?wchannelid=bxn9claes7&wmediaid=y0imzc9lb9",
        "title": "Fredericksburg City Council Worksession 11/12/2024",
        "date": "2024-11-12",
        "source_type": "video"
      },
      {
        "url": "https://www-regionalwebtv-com.filesusr.com/html/2c630b_4169353b52a2aaf92a9c9e1c8f33282b.html?wchannelid=bxn9claes7&wmediaid=b9wsey8eqn",
        "title": "Fredericksburg City Council 10/22/2024",
        "date": "2024-10-22",
        "source_type": "video"
      },
      {
        "url": "https://www-regionalwebtv-com.filesusr.com/html/2c630b_4169353b52a2aaf92a9c9e1c8f33282b.html?wchannelid=bxn9claes7&wmediaid=r79namba3n",
        "title": "Fredericksburg City Council Worksession 10/22/2024",
        "date": "2024-10-22",
        "source_type": "video"
      },
      {
        "url": "https://www-regionalwebtv-com.filesusr.com/html/2c630b_4169353b52a2aaf92a9c9e1c8f33282b.html?wchannelid=bxn9claes7&wmediaid=sq9epgczjg",
        "title": "Fredericksburg City Council 10/8/2024",
        "date": "2024-10-08",
        "source_type": "video"
      },
      {
        "url": "https://www-regionalwebtv-com.filesusr.com/html/2c630b_4169353b52a2aaf92a9c9e1c8f33282b.html?wchannelid=bxn9claes7&wmediaid=afexfl5i1n",
        "title": "Fredericksburg City Council Worksession 10/8/2024",
        "date": "2024-10-08",
        "source_type": "video"
      },
      {
        "url": "https://www-regionalwebtv-com.filesusr.com/html/2c630b_4169353b52a2aaf92a9c9e1c8f33282b.html?wchannelid=bxn9claes7&wmediaid=judletxoop",
        "title": "Fredericksburg City Council 9/24/2024",
        "date": "2024-09-24",
        "source_type": "video"
      },
      {
        "url": "https://www-regionalwebtv-com.filesusr.com/html/2c630b_4169353b52a2aaf92a9c9e1c8f33282b.html?wchannelid=bxn9claes7&wmediaid=b6b4n7t3ps",
        "title": "Fredericksburg City Council Worksession 9/24/2024",
        "date": "2024-09-24",
        "source_type": "video"
      },
      {
        "url": "https://www-regionalwebtv-com.filesusr.com/html/2c630b_4169353b52a2aaf92a9c9e1c8f33282b.html?wchannelid=bxn9claes7&wmediaid=9p8tbgfrhg",
        "title": "Fredericksburg City Council 9/10/2024",
        "date": "2024-09-10",
        "source_type": "video"
      },
      {
        "url": "https://www-regionalwebtv-com.filesusr.com/html/2c630b_4169353b52a2aaf92a9c9e1c8f33282b.html?wchannelid=bxn9claes7&wmediaid=wbsxehotwq",
        "title": "Fredericksburg City Council Worksession 9/10/2024",
        "date": "2024-09-10",
        "source_type": "video"
      },
      {
        "url": "https://www-regionalwebtv-com.filesusr.com/html/2c630b_4169353b52a2aaf92a9c9e1c8f33282b.html?wchannelid=bxn9claes7&wmediaid=o36ffd4osq",
        "title": "Fredericksburg City Council 8/27/2024",
        "date": "2024-08-27",
        "source_type": "video"
      },
      {
        "url": "https://www-regionalwebtv-com.filesusr.com/html/2c630b_4169353b52a2aaf92a9c9e1c8f33282b.html?wchannelid=bxn9claes7&wmediaid=yxobcqsfd1",
        "title": "Fredericksburg City Council Worksession 8/27/2024",
        "date": "2024-08-27",
        "source_type": "video"
      }
    ]
  },
  {
    "base_url": "https://www.youtube.com/@SLCLiveMeetings/streams",
    "medias": [
      {
        "url": "https://www.youtube.com/watch?v=jsh_2qd-tV4",
        "title": "Salt Lake City Council Work Session - 05/22/2025",
        "date": null,
        "source_type": "video"
      },
      {
        "url": "https://www.youtube.com/watch?v=mkzvlc8POwg",
        "title": "Salt Lake City LBA, CRA, and City Council Formal Meeting - 05/20/2025",
        "date": null,
        "source_type": "video"
      },
      {
        "url": "https://www.youtube.com/watch?v=pGUJbpAsCbM",
        "title": "Salt Lake City Council Work Session - 05/20/2025",
        "date": null,
        "source_type": "video"
      },
      {
        "url": "https://www.youtube.com/watch?v=hVSzRGdbBC0",
        "title": "Salt Lake City Community Reinvestment Agency (CRA) Meeting - 05/20/2025",
        "date": null,
        "source_type": "video"
      },
      {
        "url": "https://www.youtube.com/watch?v=vYTJ7GFDQ4Y",
        "title": "Planning Commission Meeting -- 05/14/2025",
        "date": null,
        "source_type": "video"
      },
      {
        "url": "https://www.youtube.com/watch?v=YqqzdPJnDgE",
        "title": "Salt Lake City LBA, CRA, and City Council Formal Meeting - 05/06/2025",
        "date": null,
        "source_type": "video"
      },
      {
        "url": "https://www.youtube.com/watch?v=SdNuJ5qX77Y",
        "title": "Salt Lake City Council Work Session - Date 05/06/2025",
        "date": null,
        "source_type": "video"
      },
      {
        "url": "https://www.youtube.com/watch?v=vqILuC7zFhE",
        "title": "Planning Commission Meeting -- 04/23/2025",
        "date": null,
        "source_type": "video"
      },
      {
        "url": "https://www.youtube.com/watch?v=fztu2LRRrQ0",
        "title": "Salt Lake City LBA, CRA, and City Council Formal Meeting - 04/15/2025",
        "date": null,
        "source_type": "video"
      },
      {
        "url": "https://www.youtube.com/watch?v=5GVFt6PN1g4&pp=0gcJCY0JAYcqIYzv",
        "title": "Salt Lake City Council Work Session - 04/15/2025",
        "date": null,
        "source_type": "video"
      },
      {
        "url": "https://www.youtube.com/watch?v=cjYd95B0DI4",
        "title": "Planning Commission Meeting -- 04/09/2025",
        "date": null,
        "source_type": "video"
      },
      {
        "url": "https://www.youtube.com/watch?v=JD5it7foxiA",
        "title": "Salt Lake City Formal Meeting - 04/08/2025",
        "date": null,
        "source_type": "video"
      },
      {
        "url": "https://www.youtube.com/watch?v=K7mLOfKXZTI",
        "title": "Salt Lake City Council Work Session - 04/08/2025",
        "date": null,
        "source_type": "video"
      },
      {
        "url": "https://www.youtube.com/watch?v=md4Z0G7AlLI",
        "title": "Salt Lake City Community Reinvestment Agency (CRA) Meeting - 04/08/2025",
        "date": null,
        "source_type": "video"
      },
      {
        "url": "https://www.youtube.com/watch?v=-s6hs8OfZTk",
        "title": "Historical Landmark Commission Meeting -- 04/03/2025",
        "date": null,
        "source_type": "video"
      },
      {
        "url": "https://www.youtube.com/watch?v=0UpRJguFC_8",
        "title": "Historical Landmark Commission Meeting -- 04/03/2025",
        "date": null,
        "source_type": "video"
      },
      {
        "url": "https://www.youtube.com/watch?v=QUf2iHd0HFg",
        "title": "Salt Lake City Formal Meeting - 4/1/2025",
        "date": null,
        "source_type": "video"
      },
      {
        "url": "https://www.youtube.com/watch?v=Yt-0GlbeXNM",
        "title": "Salt Lake City Council Work Session - 04/01/2025",
        "date": null,
        "source_type": "video"
      },
      {
        "url": "https://www.youtube.com/watch?v=HpmzTY0slNk",
        "title": "Planning Commission Meeting -- 03/26/2025",
        "date": null,
        "source_type": "video"
      },
      {
        "url": "https://www.youtube.com/watch?v=mlpgDBA2zJc",
        "title": "Salt Lake City Formal Meeting - 03/25/2025",
        "date": null,
        "source_type": "video"
      },
      {
        "url": "https://www.youtube.com/watch?v=B1PRK1wFS9s",
        "title": "Salt Lake City Council Work Session - 03/18/2025",
        "date": null,
        "source_type": "video"
      },
      {
        "url": "https://www.youtube.com/watch?v=v-HnsUTIlnE",
        "title": "Salt Lake City Community Reinvestment Agency (CRA) Meeting- 03/18/2025",
        "date": null,
        "source_type": "video"
      },
      {
        "url": "https://www.youtube.com/watch?v=FVZDiLlsyFg&pp=0gcJCY0JAYcqIYzv",
        "title": "Planning Commission Meeting -- 03/12/2025",
        "date": null,
        "source_type": "video"
      },
      {
        "url": "https://www.youtube.com/watch?v=a9KiplzWhI0",
        "title": "Salt Lake City Formal Meeting - 03/04/2025",
        "date": null,
        "source_type": "video"
      },
      {
        "url": "https://www.youtube.com/watch?v=QqVzZrqivQI",
        "title": "Salt Lake City Council Work Session - 03/04/2025",
        "date": null,
        "source_type": "video"
      },
      {
        "url": "https://www.youtube.com/watch?v=AvMHTEJjxXs",
        "title": "Salt Lake City Formal Meeting - February 18, 2025",
        "date": null,
        "source_type": "video"
      },
      {
        "url": "https://www.youtube.com/watch?v=sFM6bxEDKlY",
        "title": "Salt Lake City Council Work Session - 02/18/2025",
        "date": null,
        "source_type": "video"
      },
      {
        "url": "https://www.youtube.com/watch?v=FJecM6xNoJE",
        "title": "Planning Commission Meeting -- 02/12/2025",
        "date": null,
        "source_type": "video"
      },
      {
        "url": "https://www.youtube.com/watch?v=Sv2QfAlFraA",
        "title": "Salt Lake City Council Work Session - 2/11/2025",
        "date": null,
        "source_type": "video"
      },
      {
        "url": "https://www.youtube.com/watch?v=eRRKsS94bqc",
        "title": "Salt Lake City Community Reinvestment Agency (CRA) Meeting - 02/11/2025",
        "date": null,
        "source_type": "video"
      },
      {
        "url": "https://www.youtube.com/watch?v=Pfx_XDNANHk",
        "title": "Salt Lake City Formal Meeting - 02/04/2025",
        "date": null,
        "source_type": "video"
      },
      {
        "url": "https://www.youtube.com/watch?v=gB3-wZhDdD8",
        "title": "Salt Lake City Formal Meeting - 01/21/2025",
        "date": null,
        "source_type": "video"
      },
      {
        "url": "https://www.youtube.com/watch?v=CH4k-eIIy4s",
        "title": "Salt Lake City Council Work Session - 01/21/2025",
        "date": null,
        "source_type": "video"
      },
      {
        "url": "https://www.youtube.com/watch?v=t14LwcNzZ2s",
        "title": "Salt Lake City Community Reinvestment Agency (CRA) Meeting - 01/24/2025",
        "date": null,
        "source_type": "video"
      },
      {
        "url": "https://www.youtube.com/watch?v=FvTo7mwJ0PA",
        "title": "Historical Landmarks Commission Meeting -- 01/09/2025",
        "date": null,
        "source_type": "video"
      },
      {
        "url": "https://www.youtube.com/watch?v=p4z0TnoAgXQ",
        "title": "Planning Commission Meeting -- 01/08/2025",
        "date": null,
        "source_type": "video"
      },
      {
        "url": "https://www.youtube.com/watch?v=2jFt8q9qzfg&pp=0gcJCY0JAYcqIYzv",
        "title": "Salt Lake City Formal Meeting - 01/07/2025",
        "date": null,
        "source_type": "video"
      },
      {
        "url": "https://www.youtube.com/watch?v=RYNZu0NG5zA",
        "title": "Salt Lake City Council Work Session - 1/7/2025",
        "date": null,
        "source_type": "video"
      },
      {
        "url": "https://www.youtube.com/watch?v=6mTZu_s2oAM&pp=0gcJCY0JAYcqIYzv",
        "title": "Planning Commission Meeting -- 12/11/2024",
        "date": null,
        "source_type": "video"
      },
      {
        "url": "https://www.youtube.com/watch?v=TkzK7Q6U0U0",
        "title": "Salt Lake City Formal Meeting - 12/10/2024",
        "date": null,
        "source_type": "video"
      },
      {
        "url": "https://www.youtube.com/watch?v=c38dvoK4S20",
        "title": "Salt Lake City Council Work Session - 12/10/2024",
        "date": null,
        "source_type": "video"
      },
      {
        "url": "https://www.youtube.com/watch?v=rvm3jpfhlQY&pp=0gcJCY0JAYcqIYzv",
        "title": "Salt Lake City Redevelopment Agency (RDA) Meeting - Date 12/10/2024",
        "date": null,
        "source_type": "video"
      },
      {
        "url": "https://www.youtube.com/watch?v=gKgzHY9Ia7Y",
        "title": "Salt Lake City Formal Meeting - 12/03/2024",
        "date": null,
        "source_type": "video"
      },
      {
        "url": "https://www.youtube.com/watch?v=cWEf-jjHjkU",
        "title": "Salt Lake City Council Work Session - 12/3/2024",
        "date": null,
        "source_type": "video"
      },
      {
        "url": "https://www.youtube.com/watch?v=Q677J5Hapns",
        "title": "Salt Lake City Formal Meeting - 11/19/2024",
        "date": null,
        "source_type": "video"
      },
      {
        "url": "https://www.youtube.com/watch?v=stCzRmbc_iQ",
        "title": "Salt Lake City Council Work Session - 11/19/2024",
        "date": null,
        "source_type": "video"
      },
      {
        "url": "https://www.youtube.com/watch?v=qvDCK_TcpGU",
        "title": "Planning Commission Meeting -- 11/13/2024",
        "date": null,
        "source_type": "video"
      },
      {
        "url": "https://www.youtube.com/watch?v=IQwnX-dqZ80",
        "title": "Salt Lake City Council Work Session - 11/12/2024",
        "date": null,
        "source_type": "video"
      },
      {
        "url": "https://www.youtube.com/watch?v=wwYvEeEV1Pk",
        "title": "Salt Lake City Redevelopment Agency (RDA) Meeting - 11/12/2024",
        "date": null,
        "source_type": "video"
      },
      {
        "url": "https://www.youtube.com/watch?v=kFhUDTP8Nvo",
        "title": "Historical Landmarks Commission Meeting -- 11/07/2024",
        "date": null,
        "source_type": "video"
      },
      {
        "url": "https://www.youtube.com/watch?v=S76PF5TuJDA",
        "title": "Planning Commission Meeting -- 10/23/2024",
        "date": null,
        "source_type": "video"
      },
      {
        "url": "https://www.youtube.com/watch?v=y7alkZndrFQ",
        "title": "Salt Lake City Formal Meeting - 10/15/2024",
        "date": null,
        "source_type": "video"
      },
      {
        "url": "https://www.youtube.com/watch?v=LC1NXnJ3vIQ",
        "title": "Salt Lake City Council Work Session - 10/15/2024",
        "date": null,
        "source_type": "video"
      },
      {
        "url": "https://www.youtube.com/watch?v=nUezMWzKOMQ",
        "title": "Planning Commission Meeting -- 10/09/2024",
        "date": null,
        "source_type": "video"
      },
      {
        "url": "https://www.youtube.com/watch?v=glEzbftOw_w&pp=0gcJCY0JAYcqIYzv",
        "title": "Salt Lake City Council Work Session - 10/08/2024",
        "date": null,
        "source_type": "video"
      },
      {
        "url": "https://www.youtube.com/watch?v=BUiuvEUcxew",
        "title": "Salt Lake City Redevelopment Agency (RDA) Meeting - 10/08/2024",
        "date": null,
        "source_type": "video"
      },
      {
        "url": "https://www.youtube.com/watch?v=OXBrDcV2cDU",
        "title": "Historical Landmarks Commission Meeting -- 10/03/2024",
        "date": null,
        "source_type": "video"
      },
      {
        "url": "https://www.youtube.com/watch?v=r5z7nFxUF0Y",
        "title": "Salt Lake City Formal Meeting - 10/01/2024",
        "date": null,
        "source_type": "video"
      },
      {
        "url": "https://www.youtube.com/watch?v=CrsK3VVcwes",
        "title": "Salt Lake City Council Work Session - Date 10/01/2024",
        "date": null,
        "source_type": "video"
      },
      {
        "url": "https://www.youtube.com/watch?v=Jz8K3CHsw1g",
        "title": "Planning Commission Meeting -- 09/25/2024",
        "date": null,
        "source_type": "video"
      },
      {
        "url": "https://www.youtube.com/watch?v=7YpChyhW2BU",
        "title": "Salt Lake City Formal Meeting - 09/17/2024",
        "date": null,
        "source_type": "video"
      },
      {
        "url": "https://www.youtube.com/watch?v=4NxbubU-Utg",
        "title": "Planning Commission Meeting -- 09/11/2024",
        "date": null,
        "source_type": "video"
      },
      {
        "url": "https://www.youtube.com/watch?v=0r9YM0ykUiA&pp=0gcJCY0JAYcqIYzv",
        "title": "Salt Lake City Council Work Session - 09/10/2024",
        "date": null,
        "source_type": "video"
      },
      {
        "url": "https://www.youtube.com/watch?v=p5joROr2CC8",
        "title": "Salt Lake City Redevelopment Agency (RDA) Meeting - 09/10/2024",
        "date": null,
        "source_type": "video"
      },
      {
        "url": "https://www.youtube.com/watch?v=W8mqD_Cw-Os",
        "title": "Historical Landmarks Commission Meeting -- 09/05/2024",
        "date": null,
        "source_type": "video"
      },
      {
        "url": "https://www.youtube.com/watch?v=JnElQWt15SE",
        "title": "Salt Lake City Council Formal Meeting - 09/03/2024",
        "date": null,
        "source_type": "video"
      },
      {
        "url": "https://www.youtube.com/watch?v=qSV7NBoxCX4",
        "title": "Planning Commission Meeting -- 08/28/2024",
        "date": null,
        "source_type": "video"
      },
      {
        "url": "https://www.youtube.com/watch?v=vqNrPD0D5Cc",
        "title": "Salt Lake City Formal Meeting - Date 08/27/2024",
        "date": null,
        "source_type": "video"
      },
      {
        "url": "https://www.youtube.com/watch?v=nllrry8eTrg",
        "title": "Salt Lake City Council Work Session 08/27/2024",
        "date": null,
        "source_type": "video"
      },
      {
        "url": "https://www.youtube.com/watch?v=TELSDo3eaps",
        "title": "Planning Commission Meeting -- 08/14/2024",
        "date": null,
        "source_type": "video"
      },
      {
        "url": "https://www.youtube.com/watch?v=6dAxRgLUwY0",
        "title": "Salt Lake City Council Formal Meeting - August 13, 2024",
        "date": null,
        "source_type": "video"
      },
      {
        "url": "https://www.youtube.com/watch?v=o6WvChwhOX0",
        "title": "Salt Lake City Council Work Session - 08/13/2024",
        "date": null,
        "source_type": "video"
      },
      {
        "url": "https://www.youtube.com/watch?v=OFn9Gzv0SmU",
        "title": "Salt Lake City Redevelopment Agency (RDA) Meeting - 08/13/2024",
        "date": null,
        "source_type": "video"
      },
      {
        "url": "https://www.youtube.com/watch?v=CGCMiqdXBqk",
        "title": "Historical Landmarks Commission Meeting -- 08/01/2024",
        "date": null,
        "source_type": "video"
      },
      {
        "url": "https://www.youtube.com/watch?v=GW8WeL2Bxds&pp=0gcJCY0JAYcqIYzv",
        "title": "Planning Commission Meeting -- 07/31/2024",
        "date": null,
        "source_type": "video"
      },
      {
        "url": "https://www.youtube.com/watch?v=0hThFcufIkQ",
        "title": "Planning Commission Meeting -- 07/10/2024",
        "date": null,
        "source_type": "video"
      },
      {
        "url": "https://www.youtube.com/watch?v=SZzQ2OcCqAk",
        "title": "Salt Lake City RDA and City Council Formal Meeting - 07/09/2024",
        "date": null,
        "source_type": "video"
      },
      {
        "url": "https://www.youtube.com/watch?v=4sig2MdUumo",
        "title": "Salt Lake City Council Work Session - 07/09/2024",
        "date": null,
        "source_type": "video"
      },
      {
        "url": "https://www.youtube.com/watch?v=9eQllMJi9vw",
        "title": "Salt Lake City Council Redevelopment Agency (RDA) Meeting - 07/09/2024",
        "date": null,
        "source_type": "video"
      },
      {
        "url": "https://www.youtube.com/watch?v=VMfRYmE0L4o",
        "title": "Salt Lake City Formal Meeting - 07/02/ 2024",
        "date": null,
        "source_type": "video"
      },
      {
        "url": "https://www.youtube.com/watch?v=06MBPmauxPg",
        "title": "Salt Lake City Council Work Session - July 2, 2024",
        "date": null,
        "source_type": "video"
      },
      {
        "url": "https://www.youtube.com/watch?v=5zkjUqI9AXc",
        "title": "Planning Commission Meeting -- 06/26/2024",
        "date": null,
        "source_type": "video"
      },
      {
        "url": "https://www.youtube.com/watch?v=pCaQ9i0Gjbw",
        "title": "Planning Commission Meeting -- 06/12/2024",
        "date": null,
        "source_type": "video"
      },
      {
        "url": "https://www.youtube.com/watch?v=EDzOAejjrGQ&pp=0gcJCY0JAYcqIYzv",
        "title": "Salt Lake City LBA, RDA, and City Council Formal Meeting - 06/11/2024",
        "date": null,
        "source_type": "video"
      },
      {
        "url": "https://www.youtube.com/watch?v=iFW8vg7vgbk",
        "title": "Salt Lake City Council Work Session - 06/11/2024",
        "date": null,
        "source_type": "video"
      },
      {
        "url": "https://www.youtube.com/watch?v=Z_dwTtSH6uw",
        "title": "Salt Lake City Council Work Session -  06/06/2024",
        "date": null,
        "source_type": "video"
      },
      {
        "url": "https://www.youtube.com/watch?v=3dEV7V4Lowo&pp=0gcJCY0JAYcqIYzv",
        "title": "Historical Landmarks Commission Meeting -- 06/05/2024",
        "date": null,
        "source_type": "video"
      },
      {
        "url": "https://www.youtube.com/watch?v=enXmvh2i7cg",
        "title": "Salt Lake City LBA, RDA, and City Council Formal Meeting - 06/04/2024",
        "date": null,
        "source_type": "video"
      },
      {
        "url": "https://www.youtube.com/watch?v=yNd3yucDKuc",
        "title": "Salt Lake City Council Work Session - 06/04/2024",
        "date": null,
        "source_type": "video"
      },
      {
        "url": "https://www.youtube.com/watch?v=I-1cPm_Ctjk&pp=0gcJCY0JAYcqIYzv",
        "title": "Salt Lake City Council Work Session - 05/30/2024",
        "date": null,
        "source_type": "video"
      },
      {
        "url": "https://www.youtube.com/watch?v=29JhfOr5-eY",
        "title": "Planning Commission Meeting -- 5/22/2024",
        "date": null,
        "source_type": "video"
      },
      {
        "url": "https://www.youtube.com/watch?v=qa04Vg5N3as",
        "title": "Salt Lake City LBA, RDA, and City Council Formal Meeting - 05/21/2024",
        "date": null,
        "source_type": "video"
      },
      {
        "url": "https://www.youtube.com/watch?v=C-njIbHJg_8",
        "title": "Salt Lake City Council Work Session - 05/21/2024",
        "date": null,
        "source_type": "video"
      },
      {
        "url": "https://www.youtube.com/watch?v=-PU410wZ5Lg",
        "title": "Salt Lake City Redevelopment Agency (RDA) Meeting - 05/21/2024",
        "date": null,
        "source_type": "video"
      },
      {
        "url": "https://www.youtube.com/watch?v=OdnNgamtMrA",
        "title": "Planning Commission Meeting - 05/08/2024",
        "date": null,
        "source_type": "video"
      },
      {
        "url": "https://www.youtube.com/watch?v=hUB-vryakaE",
        "title": "Salt Lake City Council Work Session - 05/07/2024",
        "date": null,
        "source_type": "video"
      },
      {
        "url": "https://www.youtube.com/watch?v=75HRqikyJnc",
        "title": "Planning Commission Meeting - 04/24/2024",
        "date": null,
        "source_type": "video"
      },
      {
        "url": "https://www.youtube.com/watch?v=r9MgPwrarI8",
        "title": "Salt Lake City Council Formal Meeting - 04/16/2024",
        "date": null,
        "source_type": "video"
      },
      {
        "url": "https://www.youtube.com/watch?v=HY6Mc4g_8mk",
        "title": "Salt Lake City Council Work Session - 04/16/2024",
        "date": null,
        "source_type": "video"
      },
      {
        "url": "https://www.youtube.com/watch?v=zhtPdqXr6bw",
        "title": "Salt Lake City Redevelopment Agency (RDA) Meeting - 04/16/2024",
        "date": null,
        "source_type": "video"
      },
      {
        "url": "https://www.youtube.com/watch?v=nxRfaFheR7U",
        "title": "Planning Commission Meeting - 04/10/2024",
        "date": null,
        "source_type": "video"
      },
      {
        "url": "https://www.youtube.com/watch?v=t7Cblaqx3vw",
        "title": "Salt Lake City Formal Meeting - 04/02/2024",
        "date": null,
        "source_type": "video"
      },
      {
        "url": "https://www.youtube.com/watch?v=6asacnZjwDA",
        "title": "Salt Lake City Council Work Session - 04/02/2024",
        "date": null,
        "source_type": "video"
      },
      {
        "url": "https://www.youtube.com/watch?v=cDBnGNY3TaI&pp=0gcJCY0JAYcqIYzv",
        "title": "Planning Commission Meeting - 03/27/2024",
        "date": null,
        "source_type": "video"
      },
      {
        "url": "https://www.youtube.com/watch?v=NczNQt4gETQ",
        "title": "Salt Lake City Council Formal Meeting - 03/26/2024",
        "date": null,
        "source_type": "video"
      },
      {
        "url": "https://www.youtube.com/watch?v=ndfnB_h5-wM",
        "title": "Salt Lake City Council Work Session March 26, 2024",
        "date": null,
        "source_type": "video"
      },
      {
        "url": "https://www.youtube.com/watch?v=qZgPpHDFE_o&pp=0gcJCY0JAYcqIYzv",
        "title": "Salt Lake City Council Work Session - 03/19/2024",
        "date": null,
        "source_type": "video"
      },
      {
        "url": "https://www.youtube.com/watch?v=_xblfK8LP3I",
        "title": "Salt Lake City Redevelopment Agency (RDA) Meeting - 03/19/2024",
        "date": null,
        "source_type": "video"
      },
      {
        "url": "https://www.youtube.com/watch?v=uF7JUL7ymEg",
        "title": "Planning Commission Meeting - 03/13/2024",
        "date": null,
        "source_type": "video"
      },
      {
        "url": "https://www.youtube.com/watch?v=bZto9fMui4A",
        "title": "Historical Landmark Commission Meeting - 03/07/2024",
        "date": null,
        "source_type": "video"
      },
      {
        "url": "https://www.youtube.com/watch?v=kRHF-yk_mM4",
        "title": "Salt Lake City Council Formal Meeting - 03/05/2024",
        "date": null,
        "source_type": "video"
      },
      {
        "url": "https://www.youtube.com/watch?v=WaynWau6vpE",
        "title": "Salt Lake City Council Work Session - 03/05/2024",
        "date": null,
        "source_type": "video"
      },
      {
        "url": "https://www.youtube.com/watch?v=8xMhUi7ke30",
        "title": "Planning Commission Meeting - 02/28/2024",
        "date": null,
        "source_type": "video"
      },
      {
        "url": "https://www.youtube.com/watch?v=lBRjhhFkQwI&pp=0gcJCY0JAYcqIYzv",
        "title": "Planning Commission Meeting - 02/28/2024",
        "date": null,
        "source_type": "video"
      },
      {
        "url": "https://www.youtube.com/watch?v=MLE9W1OwWro",
        "title": "Salt Lake City Formal Meeting - 02/20/2024",
        "date": null,
        "source_type": "video"
      },
      {
        "url": "https://www.youtube.com/watch?v=XM3Ku82j0TA",
        "title": "Salt Lake City Council Work Session - 02/20/2024",
        "date": null,
        "source_type": "video"
      },
      {
        "url": "https://www.youtube.com/watch?v=x5RqgoA-wq8",
        "title": "Planning Commission Meeting - 02/14/2024",
        "date": null,
        "source_type": "video"
      },
      {
        "url": "https://www.youtube.com/watch?v=gqhcw--1dlY",
        "title": "Salt Lake City Council Work Session - 02/13/2024",
        "date": null,
        "source_type": "video"
      },
      {
        "url": "https://www.youtube.com/watch?v=PjdHAWJr4pY",
        "title": "Salt Lake City Redevelopment Agency (RDA) Meeting - 02/13/2024",
        "date": null,
        "source_type": "video"
      },
      {
        "url": "https://www.youtube.com/watch?v=m401e0k23Ww&pp=0gcJCY0JAYcqIYzv",
        "title": "Salt Lake City Council Formal Meeting - 02/06/2024",
        "date": null,
        "source_type": "video"
      },
      {
        "url": "https://www.youtube.com/watch?v=2QJBrKJzMWM&pp=0gcJCY0JAYcqIYzv",
        "title": "Salt Lake City Council Work Session - 02/06/2024",
        "date": null,
        "source_type": "video"
      },
      {
        "url": "https://www.youtube.com/watch?v=X9sjNKLK7N0&pp=0gcJCY0JAYcqIYzv",
        "title": "Historic Landmarks Commission Meeting - 02/01/2024",
        "date": null,
        "source_type": "video"
      },
      {
        "url": "https://www.youtube.com/watch?v=t42wuJImm2E",
        "title": "Planning Commission Meeting - 01/24/2024",
        "date": null,
        "source_type": "video"
      },
      {
        "url": "https://www.youtube.com/watch?v=3t0gBxEvZaY",
        "title": "Planning Commission Meeting - 01/24/2024",
        "date": null,
        "source_type": "video"
      },
      {
        "url": "https://www.youtube.com/watch?v=qF3wHOFZauQ",
        "title": "Planning Commission Meeting - 01/24/2024",
        "date": null,
        "source_type": "video"
      },
      {
        "url": "https://www.youtube.com/watch?v=r3uLy7a7TdU",
        "title": "Salt Lake City Formal Meeting - 01/16/2024",
        "date": null,
        "source_type": "video"
      },
      {
        "url": "https://www.youtube.com/watch?v=nEv_iHB08H8",
        "title": "Planning Commission Meeting - 01/10/2024",
        "date": null,
        "source_type": "video"
      },
      {
        "url": "https://www.youtube.com/watch?v=oLhj4KWqaj4",
        "title": "Salt Lake City Council Work Session - 01/09/2024",
        "date": null,
        "source_type": "video"
      },
      {
        "url": "https://www.youtube.com/watch?v=_BSdaoDv2yA",
        "title": "Salt Lake City Redevelopment Agency (RDA) Meeting - 01/09/2024",
        "date": null,
        "source_type": "video"
      },
      {
        "url": "https://www.youtube.com/watch?v=xYNsZ6oIZLU",
        "title": "Historical Landmark Commission Meeting - 01/04/2024",
        "date": null,
        "source_type": "video"
      },
      {
        "url": "https://www.youtube.com/watch?v=y9yViRuKUsM",
        "title": "Historical Landmark Commission Meeting - 01/04/2024",
        "date": null,
        "source_type": "video"
      },
      {
        "url": "https://www.youtube.com/watch?v=dsvDLW-TWcU&pp=0gcJCY0JAYcqIYzv",
        "title": "Salt Lake City Oath of Office Ceremony 2024",
        "date": null,
        "source_type": "video"
      },
      {
        "url": "https://www.youtube.com/watch?v=O1geHGiMa80",
        "title": "Planning Commission Meeting - 12/13/2023",
        "date": null,
        "source_type": "video"
      },
      {
        "url": "https://www.youtube.com/watch?v=dCNWJ2OpcVM",
        "title": "Salt Lake City Council Formal Meeting - 12/12/2023",
        "date": null,
        "source_type": "video"
      },
      {
        "url": "https://www.youtube.com/watch?v=WYL62mLPaks",
        "title": "Salt Lake City Council Work Session - 12/12/2023",
        "date": null,
        "source_type": "video"
      },
      {
        "url": "https://www.youtube.com/watch?v=dNEiuTjaFp0&pp=0gcJCY0JAYcqIYzv",
        "title": "Salt Lake City Formal - 12/05/2023",
        "date": null,
        "source_type": "video"
      },
      {
        "url": "https://www.youtube.com/watch?v=SI6zchkGQ_I",
        "title": "Salt Lake City Council Work Session - 12/05/2023",
        "date": null,
        "source_type": "video"
      },
      {
        "url": "https://www.youtube.com/watch?v=BhS3jNs9sTg",
        "title": "Planning Commission Meeting - 11/29/2023",
        "date": null,
        "source_type": "video"
      },
      {
        "url": "https://www.youtube.com/watch?v=5EdkL0_vU20",
        "title": "Salt Lake City Formal Meeting - 11/14/2023",
        "date": null,
        "source_type": "video"
      },
      {
        "url": "https://www.youtube.com/watch?v=XePOmfFV5-k",
        "title": "Salt Lake City Council Work Session - 11/14/2023",
        "date": null,
        "source_type": "video"
      },
      {
        "url": "https://www.youtube.com/watch?v=fsNquU8od6I",
        "title": "Salt Lake City Redevelopment Agency (RDA) Meeting - 11/14/2023",
        "date": null,
        "source_type": "video"
      },
      {
        "url": "https://www.youtube.com/watch?v=Elui40tUOJI",
        "title": "Planning Commission Meeting - 11/08/2023",
        "date": null,
        "source_type": "video"
      },
      {
        "url": "https://www.youtube.com/watch?v=fiwCw_A10A8",
        "title": "Salt Lake City Formal Meeting - 11/07/2023",
        "date": null,
        "source_type": "video"
      },
      {
        "url": "https://www.youtube.com/watch?v=xfy413FkKZo",
        "title": "Salt Lake City Council Work Session - 11/07/2023",
        "date": null,
        "source_type": "video"
      },
      {
        "url": "https://www.youtube.com/watch?v=3RHYbc5RAEs",
        "title": "Historic Landmark Commission Meeting - 11/02/2023",
        "date": null,
        "source_type": "video"
      },
      {
        "url": "https://www.youtube.com/watch?v=ggPA3RepE5k",
        "title": "Planning Commission Meeting - 10/25/2023",
        "date": null,
        "source_type": "video"
      },
      {
        "url": "https://www.youtube.com/watch?v=Pln8Jah-J2c",
        "title": "Salt Lake City Formal Meeting - 10/17/2023",
        "date": null,
        "source_type": "video"
      },
      {
        "url": "https://www.youtube.com/watch?v=l93M-blSJ-Y",
        "title": "Salt Lake City Council Work Session - 10/17/2023",
        "date": null,
        "source_type": "video"
      },
      {
        "url": "https://www.youtube.com/watch?v=vDy5QNZlIyM",
        "title": "Planning Commission Meeting - 10/11/2023a",
        "date": null,
        "source_type": "video"
      },
      {
        "url": "https://www.youtube.com/watch?v=f74YYirXQOo",
        "title": "Planning Commission Meeting - 10/11/2023",
        "date": null,
        "source_type": "video"
      },
      {
        "url": "https://www.youtube.com/watch?v=zPXLVoEkEak",
        "title": "Salt Lake City Council Work Session - 10/10/2023",
        "date": null,
        "source_type": "video"
      },
      {
        "url": "https://www.youtube.com/watch?v=LSnCkGsvQU0",
        "title": "Salt Lake City Redevelopment Agency (RDA) Meeting - 10/10/2023",
        "date": null,
        "source_type": "video"
      },
      {
        "url": "https://www.youtube.com/watch?v=wb0734AvvqM",
        "title": "Historic Landmark Commission Meeting - 10/05/2023",
        "date": null,
        "source_type": "video"
      },
      {
        "url": "https://www.youtube.com/watch?v=e3g3CQYD0SQ",
        "title": "Historic Landmark Commission Meeting - 10/05/2023",
        "date": null,
        "source_type": "video"
      },
      {
        "url": "https://www.youtube.com/watch?v=2fxoRhkrmRs",
        "title": "Salt Lake City Formal Meeting - 10/03/2023",
        "date": null,
        "source_type": "video"
      },
      {
        "url": "https://www.youtube.com/watch?v=cSrjEmpqqA0&pp=0gcJCY0JAYcqIYzv",
        "title": "Salt Lake City Council Work Session - 10/03/2023",
        "date": null,
        "source_type": "video"
      },
      {
        "url": "https://www.youtube.com/watch?v=dAvbyrvibVA&pp=0gcJCY0JAYcqIYzv",
        "title": "Planning Commission Meeting - 09/27/2023",
        "date": null,
        "source_type": "video"
      },
      {
        "url": "https://www.youtube.com/watch?v=keSmGGg8BWA&pp=0gcJCY0JAYcqIYzv",
        "title": "Salt Lake City Formal Meeting - 09/19/2023",
        "date": null,
        "source_type": "video"
      },
      {
        "url": "https://www.youtube.com/watch?v=_bE6rLZPh_0",
        "title": "Salt Lake City Council Work Session - 09/19/2023",
        "date": null,
        "source_type": "video"
      },
      {
        "url": "https://www.youtube.com/watch?v=I_OjbwmK-n8",
        "title": "Planning Commission Meeting - 09/13/2023",
        "date": null,
        "source_type": "video"
      },
      {
        "url": "https://www.youtube.com/watch?v=JkDP1i1hpz4",
        "title": "Salt Lake City Redevelopment Agency (RDA) Meeting - 09/12/2023",
        "date": null,
        "source_type": "video"
      },
      {
        "url": "https://www.youtube.com/watch?v=J99CxZnMcmY",
        "title": "Historic Landmarks Commission Meeting - 09/07/2023",
        "date": null,
        "source_type": "video"
      },
      {
        "url": "https://www.youtube.com/watch?v=A_Hh1IQq_PQ",
        "title": "Salt Lake City Formal Meeting - 09/05/2023",
        "date": null,
        "source_type": "video"
      },
      {
        "url": "https://www.youtube.com/watch?v=Fxrle6GsYhA",
        "title": "Salt Lake City Council Work Session - 09/05/2023",
        "date": null,
        "source_type": "video"
      },
      {
        "url": "https://www.youtube.com/watch?v=BNSNLscB-jI",
        "title": "Planning Commission Meeting - 08/23/2023",
        "date": null,
        "source_type": "video"
      },
      {
        "url": "https://www.youtube.com/watch?v=BWEgfhezz9E",
        "title": "Planning Commission Meeting - 08/09/2023",
        "date": null,
        "source_type": "video"
      },
      {
        "url": "https://www.youtube.com/watch?v=ldYvdWCUvAM",
        "title": "Salt Lake City Formal Meeting  08/08/2023",
        "date": null,
        "source_type": "video"
      },
      {
        "url": "https://www.youtube.com/watch?v=5c1usP8RL4s",
        "title": "Salt Lake City Council Work Session - 08/08/2023",
        "date": null,
        "source_type": "video"
      },
      {
        "url": "https://www.youtube.com/watch?v=ok0Ad4lT3Zg",
        "title": "Historic Landmarks Commission Meeting - 08/03/2023",
        "date": null,
        "source_type": "video"
      },
      {
        "url": "https://www.youtube.com/watch?v=X_87avCjAKM",
        "title": "Planning Commission Meeting - 07/26/2023",
        "date": null,
        "source_type": "video"
      },
      {
        "url": "https://www.youtube.com/watch?v=mYRo3ZRhYds",
        "title": "Salt Lake City Formal Meeting - 07/18/2023",
        "date": null,
        "source_type": "video"
      },
      {
        "url": "https://www.youtube.com/watch?v=RWGzymFAN6M",
        "title": "Salt Lake City Council Work Session - 07/18/2023",
        "date": null,
        "source_type": "video"
      },
      {
        "url": "https://www.youtube.com/watch?v=GjlphExrLgI",
        "title": "Salt Lake City Council Work Session - 07/13/2023",
        "date": null,
        "source_type": "video"
      },
      {
        "url": "https://www.youtube.com/watch?v=iqGKRPgM7mw",
        "title": "Planning Commission Meeting - 07/12/2023",
        "date": null,
        "source_type": "video"
      },
      {
        "url": "https://www.youtube.com/watch?v=LRS90rPj1Iw",
        "title": "Salt Lake City Formal Meeting - 07/11/2023",
        "date": null,
        "source_type": "video"
      },
      {
        "url": "https://www.youtube.com/watch?v=2-1NG1BPwkI",
        "title": "Salt Lake City Council Work Session - 07/11/2023",
        "date": null,
        "source_type": "video"
      },
      {
        "url": "https://www.youtube.com/watch?v=-63BHYt0oT8",
        "title": "Salt Lake City Redevelopment Agency (RDA) Meeting - 07/11/2023",
        "date": null,
        "source_type": "video"
      },
      {
        "url": "https://www.youtube.com/watch?v=_TFIHyuNdVA",
        "title": "Planning Commission Meeting - 06/28/2023",
        "date": null,
        "source_type": "video"
      },
      {
        "url": "https://www.youtube.com/watch?v=-IdalcOM0dg",
        "title": "Planning Commission Meeting - 06/14/2023",
        "date": null,
        "source_type": "video"
      },
      {
        "url": "https://www.youtube.com/watch?v=ryFsXvol5nA",
        "title": "Salt Lake City Redevelopment Agency (RDA) Meeting - 06/13/2023",
        "date": null,
        "source_type": "video"
      },
      {
        "url": "https://www.youtube.com/watch?v=McuWHezXsck",
        "title": "Salt Lake City LBA, RDA, and City Council Formal Meeting - 06/06/2023",
        "date": null,
        "source_type": "video"
      },
      {
        "url": "https://www.youtube.com/watch?v=IIGTFh8sEc0",
        "title": "Salt Lake City Council Work Session - 06/06/2023",
        "date": null,
        "source_type": "video"
      },
      {
        "url": "https://www.youtube.com/watch?v=sLdJ_HCTP4o",
        "title": "Historic Landmarks Commission Meeting - 06/01/2023",
        "date": null,
        "source_type": "video"
      },
      {
        "url": "https://www.youtube.com/watch?v=UY2s9xdkIJ8",
        "title": "Salt Lake City Council Work Session - 05/25/2023",
        "date": null,
        "source_type": "video"
      },
      {
        "url": "https://www.youtube.com/watch?v=Eq_-kKHn3gw",
        "title": "Salt Lake City Planning Commission Meeting - 05/24/2023",
        "date": null,
        "source_type": "video"
      },
      {
        "url": "https://www.youtube.com/watch?v=X86PjjMFpEw",
        "title": "Salt Lake City Council Work Session - 05/16/2023",
        "date": null,
        "source_type": "video"
      },
      {
        "url": "https://www.youtube.com/watch?v=LqKCKmAj1aA",
        "title": "Salt Lake City Planning Commission Meeting - 05/10/2023",
        "date": null,
        "source_type": "video"
      },
      {
        "url": "https://www.youtube.com/watch?v=cUaejm_CtcE",
        "title": "Salt Lake City Council Work Session - 05/09/2023",
        "date": null,
        "source_type": "video"
      },
      {
        "url": "https://www.youtube.com/watch?v=bBP8pTvP72Y",
        "title": "Salt Lake City Redevelopment Agency (RDA) Meeting - 05/09/2023",
        "date": null,
        "source_type": "video"
      },
      {
        "url": "https://www.youtube.com/watch?v=VgPhNOSWsDg",
        "title": "Historic Landmark Commission Meeting - 05/04/2023",
        "date": null,
        "source_type": "video"
      },
      {
        "url": "https://www.youtube.com/watch?v=iAKbcO09cJM",
        "title": "Salt Lake City LBA, RDA, and City Council Formal Meeting - 05/02/2023",
        "date": null,
        "source_type": "video"
      },
      {
        "url": "https://www.youtube.com/watch?v=HNxTNHAkz34",
        "title": "Planning Commission Meeting - 04/026/2023",
        "date": null,
        "source_type": "video"
      },
      {
        "url": "https://www.youtube.com/watch?v=MkdJt1Oj4LM",
        "title": "Salt Lake City Formal Meeting - 04/18/2023",
        "date": null,
        "source_type": "video"
      },
      {
        "url": "https://www.youtube.com/watch?v=UrmGKlXCAYU",
        "title": "Salt Lake City Council Work Session - 04/18/2023",
        "date": null,
        "source_type": "video"
      },
      {
        "url": "https://www.youtube.com/watch?v=_1Pr4UHxVoM",
        "title": "Salt Lake City Formal Meeting - 04/11/2023",
        "date": null,
        "source_type": "video"
      },
      {
        "url": "https://www.youtube.com/watch?v=FRdmYyqGDvg",
        "title": "Salt Lake City Council Work Session - 04/11/2023",
        "date": null,
        "source_type": "video"
      },
      {
        "url": "https://www.youtube.com/watch?v=NPbyl6uZF7Q",
        "title": "Salt Lake City Redevelopment Agency (RDA) Meeting - 04/11/2023",
        "date": null,
        "source_type": "video"
      },
      {
        "url": "https://www.youtube.com/watch?v=ZxR9H7dwyOA",
        "title": "Historic Landmarks Commission Meeting - 04/06/2023",
        "date": null,
        "source_type": "video"
      },
      {
        "url": "https://www.youtube.com/watch?v=RmlfeI_Qj60",
        "title": "Salt Lake City Formal Meeting - Date 04/04/2023",
        "date": null,
        "source_type": "video"
      },
      {
        "url": "https://www.youtube.com/watch?v=GVmRntJzb14",
        "title": "Salt Lake City Council Work Session - 04/04/2023",
        "date": null,
        "source_type": "video"
      },
      {
        "url": "https://www.youtube.com/watch?v=R8iGtwKv9rU",
        "title": "Planning Commission Meeting - 03/29/2023",
        "date": null,
        "source_type": "video"
      },
      {
        "url": "https://www.youtube.com/watch?v=Viyn0auHgYc",
        "title": "Planning Commission Meeting - 03/22/2023",
        "date": null,
        "source_type": "video"
      },
      {
        "url": "https://www.youtube.com/watch?v=bCwNP6nuVAI",
        "title": "Salt Lake City Formal Meeting - 03/21/2023",
        "date": null,
        "source_type": "video"
      },
      {
        "url": "https://www.youtube.com/watch?v=caP5wrK_uaQ",
        "title": "Salt Lake City Council Work Session - 03/21/2023",
        "date": null,
        "source_type": "video"
      },
      {
        "url": "https://www.youtube.com/watch?v=62dD3INp6zo",
        "title": "Salt Lake City Council Work Session - 03/14/2023",
        "date": null,
        "source_type": "video"
      },
      {
        "url": "https://www.youtube.com/watch?v=Z-5v8ROxjS8&pp=0gcJCY0JAYcqIYzv",
        "title": "Salt Lake City Redevelopment Agency (RDA) Meeting - 03/14/2023",
        "date": null,
        "source_type": "video"
      },
      {
        "url": "https://www.youtube.com/watch?v=Fh7ywEPLfMU",
        "title": "Planning Commission Meeting - 03/08/2023",
        "date": null,
        "source_type": "video"
      },
      {
        "url": "https://www.youtube.com/watch?v=RDJPdWDako8",
        "title": "Salt Lake City Formal Meeting - 03/07/2023",
        "date": null,
        "source_type": "video"
      },
      {
        "url": "https://www.youtube.com/watch?v=lm7fid7ganc&pp=0gcJCY0JAYcqIYzv",
        "title": "Historic Landmarks Commission Meeting - 03/02/2023",
        "date": null,
        "source_type": "video"
      },
      {
        "url": "https://www.youtube.com/watch?v=1wYTI93F0zk",
        "title": "Salt Lake City Formal Meeting - 02/21/2023",
        "date": null,
        "source_type": "video"
      },
      {
        "url": "https://www.youtube.com/watch?v=tK60tHLl0Po",
        "title": "Salt Lake City Council Work Session - 02/21/2023",
        "date": null,
        "source_type": "video"
      },
      {
        "url": "https://www.youtube.com/watch?v=DNx1NRMhm4M",
        "title": "Salt Lake City Council Work Session - 02/14/2023",
        "date": null,
        "source_type": "video"
      },
      {
        "url": "https://www.youtube.com/watch?v=Y5HF-JFNXbg",
        "title": "Planning  Commission Meeting - 02/08/2023",
        "date": null,
        "source_type": "video"
      },
      {
        "url": "https://www.youtube.com/watch?v=G77bdbrDVCk",
        "title": "Salt Lake City Formal Meeting - 02/07/2023",
        "date": null,
        "source_type": "video"
      },
      {
        "url": "https://www.youtube.com/watch?v=HUB31K_HG9s&pp=0gcJCY0JAYcqIYzv",
        "title": "Planning Commission Meeting - 01/25/2023",
        "date": null,
        "source_type": "video"
      },
      {
        "url": "https://www.youtube.com/watch?v=8zmjX1zshik",
        "title": "Salt Lake City Formal Meeting - 01/17/2023",
        "date": null,
        "source_type": "video"
      },
      {
        "url": "https://www.youtube.com/watch?v=QryKwclvbbE",
        "title": "Salt Lake City Council Work Session - 01/17/2023",
        "date": null,
        "source_type": "video"
      },
      {
        "url": "https://www.youtube.com/watch?v=V1xkU1NjbFg",
        "title": "Planning Commission Meeting - 1/11/2023",
        "date": null,
        "source_type": "video"
      },
      {
        "url": "https://www.youtube.com/watch?v=Kp6X3n769IQ",
        "title": "Salt Lake City Council Work Session - 01/10/2023",
        "date": null,
        "source_type": "video"
      },
      {
        "url": "https://www.youtube.com/watch?v=utJTXhbpJEc",
        "title": "Salt Lake City Redevelopment Agency (RDA) Meeting - 01/10/2023",
        "date": null,
        "source_type": "video"
      },
      {
        "url": "https://www.youtube.com/watch?v=OFLx-6qiMXU",
        "title": "Historic Landmarks Commission Meeting - 1/5/2023",
        "date": null,
        "source_type": "video"
      },
      {
        "url": "https://www.youtube.com/watch?v=9UHkMuf6_5U",
        "title": "Salt Lake City Formal Meeting - 01/03/2023",
        "date": null,
        "source_type": "video"
      },
      {
        "url": "https://www.youtube.com/watch?v=NQiF7lQUcTM",
        "title": "Salt Lake City Council Work Session - 01/03/2023",
        "date": null,
        "source_type": "video"
      },
      {
        "url": "https://www.youtube.com/watch?v=l7uaJ6jtNW4&pp=0gcJCY0JAYcqIYzv",
        "title": "Planning Commission Meeting - 12/14/2022",
        "date": null,
        "source_type": "video"
      },
      {
        "url": "https://www.youtube.com/watch?v=oxIZjPYXeF4",
        "title": "Salt Lake City Formal Meeting - 12/13/2022",
        "date": null,
        "source_type": "video"
      },
      {
        "url": "https://www.youtube.com/watch?v=lQzpELURwfI",
        "title": "Salt Lake City Council Work Session - 12/13/2022",
        "date": null,
        "source_type": "video"
      },
      {
        "url": "https://www.youtube.com/watch?v=wCUaqCnH8Qo&pp=0gcJCY0JAYcqIYzv",
        "title": "Salt Lake City Redevelopment Agency (RDA) Meeting - 12/13/2022",
        "date": null,
        "source_type": "video"
      },
      {
        "url": "https://www.youtube.com/watch?v=-H28hun4rmc",
        "title": "Salt Lake City Council Work Session - 12/6/2022",
        "date": null,
        "source_type": "video"
      },
      {
        "url": "https://www.youtube.com/watch?v=-rMZuqqkMLo",
        "title": "Historic Landmarks Commission Meeting - 12/01/2022",
        "date": null,
        "source_type": "video"
      },
      {
        "url": "https://www.youtube.com/watch?v=CDnaCH64044",
        "title": "Salt Lake City Formal Meeting - 11/22/2022",
        "date": null,
        "source_type": "video"
      },
      {
        "url": "https://www.youtube.com/watch?v=fntoPkErQqs",
        "title": "Salt Lake City Council Work Session - 11/22/2022",
        "date": null,
        "source_type": "video"
      },
      {
        "url": "https://www.youtube.com/watch?v=a9ngD-ObOY4",
        "title": "Planning Commission Meeting - 11/16/2022",
        "date": null,
        "source_type": "video"
      },
      {
        "url": "https://www.youtube.com/watch?v=kbY4ryeMQxo",
        "title": "Salt Lake City Formal Meeting  - 11/10/2022",
        "date": null,
        "source_type": "video"
      },
      {
        "url": "https://www.youtube.com/watch?v=a-FBNsEB3Y4",
        "title": "Salt Lake City Council Work Session - 11/10/2022",
        "date": null,
        "source_type": "video"
      },
      {
        "url": "https://www.youtube.com/watch?v=BMu0YDE4ZT8&pp=0gcJCY0JAYcqIYzv",
        "title": "Salt Lake City Redevelopment Agency (RDA) Meeting - 11/10/2022",
        "date": null,
        "source_type": "video"
      },
      {
        "url": "https://www.youtube.com/watch?v=zcoINiT2_S0",
        "title": "Planning Commission Meeting - 11/09/2022",
        "date": null,
        "source_type": "video"
      },
      {
        "url": "https://www.youtube.com/watch?v=HRsMNfwMM5k",
        "title": "Historic Landmarks Commission Meeting - 11/03/2022",
        "date": null,
        "source_type": "video"
      },
      {
        "url": "https://www.youtube.com/watch?v=D9gMDpqrvTg&pp=0gcJCY0JAYcqIYzv",
        "title": "Planning Commission Meeting - 10/26/2022",
        "date": null,
        "source_type": "video"
      },
      {
        "url": "https://www.youtube.com/watch?v=aCKiU4GbaAw",
        "title": "Salt Lake City Council Formal Meeting & Redevelopment Agency (RDA) Meeting - 10/18/2022",
        "date": null,
        "source_type": "video"
      },
      {
        "url": "https://www.youtube.com/watch?v=NgqeIu6rlzU",
        "title": "Salt Lake City Council Work Session - 10/18/2022",
        "date": null,
        "source_type": "video"
      },
      {
        "url": "https://www.youtube.com/watch?v=KCANTtPZ2Ik",
        "title": "Planning Commission Meeting - 10/12/2022",
        "date": null,
        "source_type": "video"
      },
      {
        "url": "https://www.youtube.com/watch?v=QmdkaLKp9W4&pp=0gcJCY0JAYcqIYzv",
        "title": "Salt Lake City Formal Meeting - 10/11/2022",
        "date": null,
        "source_type": "video"
      },
      {
        "url": "https://www.youtube.com/watch?v=X-klYLj26wM",
        "title": "Salt Lake City Council Work Session - 10/11/2022",
        "date": null,
        "source_type": "video"
      },
      {
        "url": "https://www.youtube.com/watch?v=mTbNMxvMvq8",
        "title": "Salt Lake City Redevelopment Agency (RDA) Meeting - 10/11/2022",
        "date": null,
        "source_type": "video"
      },
      {
        "url": "https://www.youtube.com/watch?v=IIQj0a9uj3o&pp=0gcJCY0JAYcqIYzv",
        "title": "Historic Landmarks Commission Meeting - 10/06/2022",
        "date": null,
        "source_type": "video"
      },
      {
        "url": "https://www.youtube.com/watch?v=w_E4CcDr1nY",
        "title": "Salt Lake City Formal Meeting - 10/04/2022",
        "date": null,
        "source_type": "video"
      },
      {
        "url": "https://www.youtube.com/watch?v=c67eTLEXXhM",
        "title": "Salt Lake City Council Work Session -10/04/2022",
        "date": null,
        "source_type": "video"
      },
      {
        "url": "https://www.youtube.com/watch?v=IMKKALoKXfA",
        "title": "Planning Commission Meeting - 09/28/2022",
        "date": null,
        "source_type": "video"
      },
      {
        "url": "https://www.youtube.com/watch?v=4Tm2YuasJEk",
        "title": "Salt Lake City Formal Meeting - 09/20/2022",
        "date": null,
        "source_type": "video"
      },
      {
        "url": "https://www.youtube.com/watch?v=jY27zgvELWQ",
        "title": "Salt Lake City Council Work Session - 09/20/2022",
        "date": null,
        "source_type": "video"
      },
      {
        "url": "https://www.youtube.com/watch?v=8fRvrt_HzSI",
        "title": "Planning Commission Meeting - 09/14/2022",
        "date": null,
        "source_type": "video"
      },
      {
        "url": "https://www.youtube.com/watch?v=qGnJRCreQNo",
        "title": "Salt Lake City Council Work Session - 09/13/2022",
        "date": null,
        "source_type": "video"
      },
      {
        "url": "https://www.youtube.com/watch?v=osUj56YctCE",
        "title": "Salt Lake City Redevelopment Agency (RDA) Meeting - 09/13/2022",
        "date": null,
        "source_type": "video"
      },
      {
        "url": "https://www.youtube.com/watch?v=DJO3pndg3fQ",
        "title": "Salt Lake City Formal Meeting - 09/06/2022",
        "date": null,
        "source_type": "video"
      },
      {
        "url": "https://www.youtube.com/watch?v=vOa4SqN9ZC4",
        "title": "Salt Lake City Council Work Session - 09/06/2022",
        "date": null,
        "source_type": "video"
      },
      {
        "url": "https://www.youtube.com/watch?v=LddAw2ePNUs",
        "title": "Salt Lake City Limited Formal Meeting - 08/29/2022",
        "date": null,
        "source_type": "video"
      },
      {
        "url": "https://www.youtube.com/watch?v=S9xt1UZJGrQ",
        "title": "Planning Commission Meeting - 08/24/2022",
        "date": null,
        "source_type": "video"
      },
      {
        "url": "https://www.youtube.com/watch?v=r_mEySKSuS0",
        "title": "Salt Lake City Formal Meeting - 08/16/2022",
        "date": null,
        "source_type": "video"
      },
      {
        "url": "https://www.youtube.com/watch?v=XdAPw-Hm9MU",
        "title": "Salt Lake City Limited Formal Meeting - Truth in Taxation - 08/16/2022",
        "date": null,
        "source_type": "video"
      },
      {
        "url": "https://www.youtube.com/watch?v=xXNb4o8P84w",
        "title": "Planning Commission Meeting - 08/10/2022",
        "date": null,
        "source_type": "video"
      },
      {
        "url": "https://www.youtube.com/watch?v=PEEpz1KVTSI",
        "title": "Salt Lake City Formal Meeting - 08/09/2022",
        "date": null,
        "source_type": "video"
      },
      {
        "url": "https://www.youtube.com/watch?v=6AMK642UToE",
        "title": "Salt Lake City Council Work Session - 08/09/2022",
        "date": null,
        "source_type": "video"
      },
      {
        "url": "https://www.youtube.com/watch?v=THpjLg29zDU",
        "title": "Salt Lake City Redevelopment Agency (RDA) Meeting - 08/09/2022",
        "date": null,
        "source_type": "video"
      },
      {
        "url": "https://www.youtube.com/watch?v=3SYl1ahOeSY",
        "title": "Historic Landmark Commission Meeting - 08/04/2022",
        "date": null,
        "source_type": "video"
      },
      {
        "url": "https://www.youtube.com/watch?v=AeYkTKKeG10",
        "title": "Planning Commission Meeting - 07/27/2022",
        "date": null,
        "source_type": "video"
      },
      {
        "url": "https://www.youtube.com/watch?v=q9wrf1jIttk",
        "title": "Salt Lake City Formal Meeting - 07/19/2022",
        "date": null,
        "source_type": "video"
      },
      {
        "url": "https://www.youtube.com/watch?v=bJ_WSCdOvxw",
        "title": "Salt Lake City Council Work Session - 07/19/2022",
        "date": null,
        "source_type": "video"
      },
      {
        "url": "https://www.youtube.com/watch?v=eJlI1B0La50",
        "title": "Historic Landmarks Commission Meeting - 07/14/2022",
        "date": null,
        "source_type": "video"
      },
      {
        "url": "https://www.youtube.com/watch?v=qWBun2ALfgo",
        "title": "Planning Commission Meeting - 07/13/2022",
        "date": null,
        "source_type": "video"
      },
      {
        "url": "https://www.youtube.com/watch?v=2e65raZ8MoM",
        "title": "Salt Lake City Formal Meeting - 07/12/2022",
        "date": null,
        "source_type": "video"
      },
      {
        "url": "https://www.youtube.com/watch?v=e_LKelwYVqM&pp=0gcJCY0JAYcqIYzv",
        "title": "Salt Lake City Council Work Session - 07/12/2022",
        "date": null,
        "source_type": "video"
      },
      {
        "url": "https://www.youtube.com/watch?v=5iSct986Q28&pp=0gcJCY0JAYcqIYzv",
        "title": "Planning Commission Meeting - 06/22/2022",
        "date": null,
        "source_type": "video"
      },
      {
        "url": "https://www.youtube.com/watch?v=YzU7LkEDU-M",
        "title": "Salt Lake City LBA, RDA, and City Council Formal Meeting - 06/14/2022",
        "date": null,
        "source_type": "video"
      },
      {
        "url": "https://www.youtube.com/watch?v=i5Ddpb_Z7Ko",
        "title": "Salt Lake City Council Work Session - 06/14/2022",
        "date": null,
        "source_type": "video"
      },
      {
        "url": "https://www.youtube.com/watch?v=74HykyxCg7w",
        "title": "Salt Lake City Council Work Session - 06/09/2022",
        "date": null,
        "source_type": "video"
      },
      {
        "url": "https://www.youtube.com/watch?v=69d3-KmUbds",
        "title": "Planning Commission Meeting - 06/08/2022",
        "date": null,
        "source_type": "video"
      },
      {
        "url": "https://www.youtube.com/watch?v=Pj6Gi0tJG7k",
        "title": "Salt Lake City LBA, RDA, and Council Formal Meeting - 06/07/2022",
        "date": null,
        "source_type": "video"
      },
      {
        "url": "https://www.youtube.com/watch?v=UJvSxb4m344",
        "title": "Salt Lake City Council Work Session - 06/07/2022",
        "date": null,
        "source_type": "video"
      },
      {
        "url": "https://www.youtube.com/watch?v=t4eOS9zNZPw",
        "title": "Salt Lake City Council Work Session & Limited Formal - 06/02/2022",
        "date": null,
        "source_type": "video"
      },
      {
        "url": "https://www.youtube.com/watch?v=FVPrp-Q-DdM",
        "title": "Historic Landmarks Commission Meeting - 06/01/2022",
        "date": null,
        "source_type": "video"
      },
      {
        "url": "https://www.youtube.com/watch?v=RWvhkMDLzvc",
        "title": "City Council Budget AMA - June 01, 2022",
        "date": null,
        "source_type": "video"
      },
      {
        "url": "https://www.youtube.com/watch?v=r41ZQgJwLWk",
        "title": "Planning Commission Meeting - May 25, 2022",
        "date": null,
        "source_type": "video"
      },
      {
        "url": "https://www.youtube.com/watch?v=2odPa4jNwiA",
        "title": "Salt Lake City Council Work Session - 05/24/2022",
        "date": null,
        "source_type": "video"
      },
      {
        "url": "https://www.youtube.com/watch?v=oXEGvW06Y3Y",
        "title": "Salt Lake City LBA, RDA, and Council Formal Meeting - 05/17/2022",
        "date": null,
        "source_type": "video"
      },
      {
        "url": "https://www.youtube.com/watch?v=MdRxZ90cV3g",
        "title": "Salt Lake City Council Work Session - 05/17/2022",
        "date": null,
        "source_type": "video"
      },
      {
        "url": "https://www.youtube.com/watch?v=xfzNux6iZgs",
        "title": "Salt Lake City Redevelopment Agency (RDA) Meeting - 05/17/2022",
        "date": null,
        "source_type": "video"
      },
      {
        "url": "https://www.youtube.com/watch?v=HefOOb8q4m0",
        "title": "Planning Commission Meeting - May 11, 2022",
        "date": null,
        "source_type": "video"
      },
      {
        "url": "https://www.youtube.com/watch?v=1gKX5QXP1Jg",
        "title": "Salt Lake City Limited Formal Meeting - 05/10/2022",
        "date": null,
        "source_type": "video"
      },
      {
        "url": "https://www.youtube.com/watch?v=4gDEMPXPGZk&pp=0gcJCY0JAYcqIYzv",
        "title": "Salt Lake City Council Work Session - 05/10/2022",
        "date": null,
        "source_type": "video"
      },
      {
        "url": "https://www.youtube.com/watch?v=wM1aevA2lY4",
        "title": "Historic Landmarks Commission Meeting - May 05, 2022",
        "date": null,
        "source_type": "video"
      },
      {
        "url": "https://www.youtube.com/watch?v=YjpIib4bRgk",
        "title": "Salt Lake City Council Work Session - 05/03/2022",
        "date": null,
        "source_type": "video"
      },
      {
        "url": "https://www.youtube.com/watch?v=TrTKctHOScg",
        "title": "Planning Commission Meeting - April 27, 2022",
        "date": null,
        "source_type": "video"
      },
      {
        "url": "https://www.youtube.com/watch?v=3vruoUQBieE",
        "title": "Salt Lake City Formal Meeting - 04/19/2022",
        "date": null,
        "source_type": "video"
      },
      {
        "url": "https://www.youtube.com/watch?v=UiidA6GjJLE",
        "title": "Salt Lake City Council Work Session - 4/19/2022",
        "date": null,
        "source_type": "video"
      },
      {
        "url": "https://www.youtube.com/watch?v=MDuxQChU5iY",
        "title": "Planning Commission Meeting - April 13, 2022",
        "date": null,
        "source_type": "video"
      },
      {
        "url": "https://www.youtube.com/watch?v=8bSqNBDr_Nk",
        "title": "Salt Lake City Council Work Session & Limited Formal - 04/12/2022",
        "date": null,
        "source_type": "video"
      },
      {
        "url": "https://www.youtube.com/watch?v=sdooiS-GCFY",
        "title": "Historic Landmarks Commission Meeting - April 07, 2022",
        "date": null,
        "source_type": "video"
      },
      {
        "url": "https://www.youtube.com/watch?v=2bAelhFZFmc",
        "title": "Salt Lake City Formal Meeting - 04/05/2022",
        "date": null,
        "source_type": "video"
      },
      {
        "url": "https://www.youtube.com/watch?v=YLmsCHYvK7Q",
        "title": "Salt Lake City Council Work Session - 04/05/2022",
        "date": null,
        "source_type": "video"
      },
      {
        "url": "https://www.youtube.com/watch?v=BhNnUDGK-3c",
        "title": "Planning Commission Meeting - March 23, 2022",
        "date": null,
        "source_type": "video"
      },
      {
        "url": "https://www.youtube.com/watch?v=oseV7zllFco&pp=0gcJCY0JAYcqIYzv",
        "title": "Planning Commission Meeting - March 09, 2022",
        "date": null,
        "source_type": "video"
      },
      {
        "url": "https://www.youtube.com/watch?v=GScaK-kkvTU",
        "title": "Salt Lake City Council Work Session - 03/08/2022",
        "date": null,
        "source_type": "video"
      },
      {
        "url": "https://www.youtube.com/watch?v=6QQr3ZFTVNc",
        "title": "Salt Lake City Redevelopment Agency (RDA) Meeting - 03/08/2022",
        "date": null,
        "source_type": "video"
      },
      {
        "url": "https://www.youtube.com/watch?v=BMeDLn-XcOY",
        "title": "Salt Lake City Formal Meeting - 03/01/2022",
        "date": null,
        "source_type": "video"
      },
      {
        "url": "https://www.youtube.com/watch?v=KFqJUsQQIRw",
        "title": "Salt Lake City Council Work Session - 03/1/2022",
        "date": null,
        "source_type": "video"
      },
      {
        "url": "https://www.youtube.com/watch?v=7cnfWwNSd2U",
        "title": "Planning Commission Meeting - February 23, 2022",
        "date": null,
        "source_type": "video"
      },
      {
        "url": "https://www.youtube.com/watch?v=apf3wK_EqZY",
        "title": "Salt Lake City Formal Meeting - 02/15/2022",
        "date": null,
        "source_type": "video"
      },
      {
        "url": "https://www.youtube.com/watch?v=eSx2ahwnDWA",
        "title": "Salt Lake City Council Work Session - 02/15/2022",
        "date": null,
        "source_type": "video"
      },
      {
        "url": "https://www.youtube.com/watch?v=b0rknIgKsSs",
        "title": "Planning Commission Meeting - February 09, 2022",
        "date": null,
        "source_type": "video"
      },
      {
        "url": "https://www.youtube.com/watch?v=KdGSe1xvahQ",
        "title": "Salt Lake City Council Work Session - 02/08/2022",
        "date": null,
        "source_type": "video"
      },
      {
        "url": "https://www.youtube.com/watch?v=cEmkdC1Cols&pp=0gcJCY0JAYcqIYzv",
        "title": "Salt Lake City Redevelopment Agency (RDA) Meeting - 02/08/2022",
        "date": null,
        "source_type": "video"
      },
      {
        "url": "https://www.youtube.com/watch?v=5qb6wrKWuEg",
        "title": "Historic Landmarks Commission Meeting - February 03, 2022",
        "date": null,
        "source_type": "video"
      },
      {
        "url": "https://www.youtube.com/watch?v=GO4coYEMzH4",
        "title": "Salt Lake City Formal Meeting - 02/01/2022",
        "date": null,
        "source_type": "video"
      },
      {
        "url": "https://www.youtube.com/watch?v=jua_j_moW_U",
        "title": "Salt Lake City Council Work Session - 02/01/2022",
        "date": null,
        "source_type": "video"
      },
      {
        "url": "https://www.youtube.com/watch?v=Oj98B1L6ILU",
        "title": "Planning Commission Meeting - January 26, 2022",
        "date": null,
        "source_type": "video"
      },
      {
        "url": "https://www.youtube.com/watch?v=Uxzts4E_UCM",
        "title": "Salt Lake City Redevelopment Agency (RDA) Meeting - 1/18/2022",
        "date": null,
        "source_type": "video"
      },
      {
        "url": "https://www.youtube.com/watch?v=zYv9vZe-ua4",
        "title": "Planning Commission Meeting - January 12, 2022",
        "date": null,
        "source_type": "video"
      },
      {
        "url": "https://www.youtube.com/watch?v=zKAG5J5pNCE",
        "title": "Historic Landmarks Commission Meeting - January 06, 2022",
        "date": null,
        "source_type": "video"
      },
      {
        "url": "https://www.youtube.com/watch?v=x6325s1VQ0U",
        "title": "Salt Lake City Council Formal Meeting - 01/04/2022",
        "date": null,
        "source_type": "video"
      },
      {
        "url": "https://www.youtube.com/watch?v=dXTYPoVpqWY",
        "title": "Salt Lake City Council Work Session - 01/04/2022",
        "date": null,
        "source_type": "video"
      },
      {
        "url": "https://www.youtube.com/watch?v=5GTSvfjvKtY",
        "title": "Planning Commission Meeting - December 15, 2021",
        "date": null,
        "source_type": "video"
      },
      {
        "url": "https://www.youtube.com/watch?v=R7oJxau1eDI",
        "title": "Salt Lake City Council Work Session - 12/14/2021",
        "date": null,
        "source_type": "video"
      },
      {
        "url": "https://www.youtube.com/watch?v=s5IUHMfeJjA",
        "title": "Salt Lake City Redevelopment Agency (RDA) Meeting - 12/14/2021",
        "date": null,
        "source_type": "video"
      },
      {
        "url": "https://www.youtube.com/watch?v=1qd6ABheRug",
        "title": "Planning Commission Meeting - December 08, 2021",
        "date": null,
        "source_type": "video"
      },
      {
        "url": "https://www.youtube.com/watch?v=Myu7cfD9wSo",
        "title": "Salt Lake City Formal Meeting - 12/07/2021",
        "date": null,
        "source_type": "video"
      },
      {
        "url": "https://www.youtube.com/watch?v=DV99g_rJC58",
        "title": "Salt Lake City Council Work Session - 12/07/2021",
        "date": null,
        "source_type": "video"
      },
      {
        "url": "https://www.youtube.com/watch?v=Yl8lFprZwcs",
        "title": "Historic Landmarks Commission Meeting - December 02, 2021",
        "date": null,
        "source_type": "video"
      },
      {
        "url": "https://www.youtube.com/watch?v=KtBq1-FrdK4",
        "title": "Salt Lake City Formal Meeting - 11/16/2021",
        "date": null,
        "source_type": "video"
      },
      {
        "url": "https://www.youtube.com/watch?v=K-IK0KbwQH8",
        "title": "Salt Lake City Council Work Session - 11/16/2021",
        "date": null,
        "source_type": "video"
      },
      {
        "url": "https://www.youtube.com/watch?v=6nyXJKMmP_0",
        "title": "Planning Commission Meeting - November 10, 2021",
        "date": null,
        "source_type": "video"
      },
      {
        "url": "https://www.youtube.com/watch?v=DIXBmBlLYXU",
        "title": "Salt Lake City Formal Meeting - 11/09/2021",
        "date": null,
        "source_type": "video"
      },
      {
        "url": "https://www.youtube.com/watch?v=UGqPCcfsH2s&pp=0gcJCY0JAYcqIYzv",
        "title": "Salt Lake City Council Work Session - 11/09/2021",
        "date": null,
        "source_type": "video"
      },
      {
        "url": "https://www.youtube.com/watch?v=1a0dCjItEFw",
        "title": "Historic Landmarks Commission Meeting - November 04, 2021",
        "date": null,
        "source_type": "video"
      },
      {
        "url": "https://www.youtube.com/watch?v=4HzcUwcsTbk",
        "title": "Planning Commission Meeting - October 27, 2021",
        "date": null,
        "source_type": "video"
      },
      {
        "url": "https://www.youtube.com/watch?v=2QxV-o4Zte0",
        "title": "Salt Lake City Council Formal Meeting - 10/19/2021",
        "date": null,
        "source_type": "video"
      },
      {
        "url": "https://www.youtube.com/watch?v=ND_WnLyUuEg",
        "title": "Salt Lake City Work Session - 10/19/21",
        "date": null,
        "source_type": "video"
      },
      {
        "url": "https://www.youtube.com/watch?v=7NYFOj3-SQo",
        "title": "Historic Landmarks Commission Meeting - October 14, 2021",
        "date": null,
        "source_type": "video"
      },
      {
        "url": "https://www.youtube.com/watch?v=yItHyejvNSI",
